alexa-skills-kit-nodejs-factskill,arn:aws:serverlessrepo:us-east-1:173334852312:applications/alexa-skills-kit-nodejs-factskill,Alexa Skills Kit,47600,"skills,fact,alexa","This Alexa sample skill is a template for a basic fact skill. Provided a list of interesting facts about a topic, Alexa will select a fact at random and tell it to the user when the skill is invoked.",https://github.com/alexa/skill-sample-nodejs-fact,
hello-world,arn:aws:serverlessrepo:us-east-1:077246666028:applications/hello-world,AWS,4182,,A starter hello-world serverless application,https://github.com/aws-samples/serverless-app-examples/tree/master/javascript/hello-world,
alexa-skills-kit-nodejs-triviaskill,arn:aws:serverlessrepo:us-east-1:173334852312:applications/alexa-skills-kit-nodejs-triviaskill,Alexa Skills Kit,3785,"skill,trivia,alexa",This Alexa sample skill is a template for a trivia style game with score keeping. Alexa will ask you a multiple choice questions and seek your response. Correct and Incorrect answers to questions are recorded.,https://github.com/alexa/skill-sample-nodejs-trivia,
SecretsManagerRDSMySQLRotationSingleUser,arn:aws:serverlessrepo:us-east-1:297356227824:applications/SecretsManagerRDSMySQLRotationSingleUser,AWS Secrets Manager,2842,,Conducts an AWS SecretsManager secret rotation for RDS MySQL using the single user rotation scheme,,"CAPABILITY_IAM,CAPABILITY_RESOURCE_POLICY"
alexa-skills-kit-nodejs-howtoskill,arn:aws:serverlessrepo:us-east-1:173334852312:applications/alexa-skills-kit-nodejs-howtoskill,Alexa Skills Kit,2299,"howto,skill,alexa","Create a parameter-based skill using a template called ‘Minecraft Helper’. Ask how to craft an item in the game Minecraft, and this skill will give you instructions.",https://github.com/alexa/skill-sample-nodejs-howto,
SecretsManagerRDSPostgreSQLRotationSingleUser,arn:aws:serverlessrepo:us-east-1:297356227824:applications/SecretsManagerRDSPostgreSQLRotationSingleUser,AWS Secrets Manager,1709,,Conducts an AWS SecretsManager secret rotation for RDS PostgreSQL using single user rotation scheme,,"CAPABILITY_IAM,CAPABILITY_RESOURCE_POLICY"
Datadog-Log-Forwarder,arn:aws:serverlessrepo:us-east-1:464622532012:applications/Datadog-Log-Forwarder,Datadog,1428,"s3,analytics,tail,datadog,cloudwatch,metrics,logs,alerting","The Datadog log forwarder ships logs stored in S3 and CloudWatch Logs to Datadog for live search, analytics, and alerting.",https://github.com/DataDog/datadog-serverless-functions/tree/master/aws/logs_monitoring,
alexa-skills-kit-python36-factskill,arn:aws:serverlessrepo:us-east-1:173334852312:applications/alexa-skills-kit-python36-factskill,Alexa Skills Kit,1263,"skills,fact,alexa,python36","This Alexa sample skill is a template for a basic fact skill.  When the skill is invoked, Alexa will select a random fact from a list of interesting facts about a topic and tell it to the user.  Python 3.6",https://github.com/alexa/skill-sample-python-fact,
microservice-http-endpoint,arn:aws:serverlessrepo:us-east-1:077246666028:applications/microservice-http-endpoint,AWS,1205,,A simple backend (read/write to DynamoDB) with a RESTful API endpoint using Amazon API Gateway.,https://github.com/aws-samples/serverless-app-examples/tree/master/javascript/microservice-http-endpoint,
CICD-toolchain-for-serverless-applications,arn:aws:serverlessrepo:us-east-1:713482062377:applications/CICD-toolchain-for-serverless-applications,AWS Lambda console,1125,,Automated deployment toolchain used by new serverless applications created through the AWS Lambda console,https://console.aws.amazon.com/lambda/home,"CAPABILITY_NAMED_IAM,CAPABILITY_RESOURCE_POLICY"
alexa-skills-kit-color-expert-python,arn:aws:serverlessrepo:us-east-1:077246666028:applications/alexa-skills-kit-color-expert-python,AWS,980,,Demonstrates a basic skill built with the Amazon Alexa Skills Kit.,https://github.com/aws-samples/serverless-app-examples/tree/master/python/alexa-skills-kit-color-expert-python,
image-resizer-service,arn:aws:serverlessrepo:us-east-1:526515951862:applications/image-resizer-service,Cagatay Gurturk,971,"jpg,image,png,resize,picture",This serverless application deploys a Lambda function and API Gateway to your AWS account that reads images from a S3 bucket (whose name defined at deployment) and serves them through API Gateway with original or desired dimensions.,https://github.com/cagataygurturk/image-resizer-service,
alexa-skills-kit-nodejs-premium-facts-skill,arn:aws:serverlessrepo:us-east-1:173334852312:applications/alexa-skills-kit-nodejs-premium-facts-skill,Alexa Skills Kit,712,"skills,nodejs810,fact,monetization,alexa,in-skill-purchasing","This Alexa sample skill is a template for a fact skill with premium content.  When the skill is invoked, Alexa will select a random fact from the categories available to the user.  The skill allows customers to purchase access to additional categories.",https://github.com/alexa/skill-sample-nodejs-fact-in-skill-purchases,
alexa-smart-home-skill-adapter,arn:aws:serverlessrepo:us-east-1:077246666028:applications/alexa-smart-home-skill-adapter,AWS,680,,Provides the basic framework for a skill adapter for a smart home skill.,https://github.com/aws-samples/serverless-app-examples/tree/master/javascript/alexa-smart-home-skill-adapter,
SecretsManagerRDSMySQLRotationMultiUser,arn:aws:serverlessrepo:us-east-1:297356227824:applications/SecretsManagerRDSMySQLRotationMultiUser,AWS Secrets Manager,666,,Conducts an AWS SecretsManager secret rotation for RDS MySQL using the multiple user rotation scheme,,"CAPABILITY_IAM,CAPABILITY_RESOURCE_POLICY"
simple-websockets-chat-app,arn:aws:serverlessrepo:us-east-1:729047367331:applications/simple-websockets-chat-app,Amazon API Gateway Team,632,"apigateway,chat,api,websockets,gateway","This provides the backend Lambda functions, DynamoDB table, and IAM roles used to build a chat app using API Gateway.  See https://aws.amazon.com/blogs/compute/announcing-websocket-apis-in-amazon-api-gateway for all the details!",https://aws.amazon.com/blogs/compute/announcing-websocket-apis-in-amazon-api-gateway,"CAPABILITY_IAM,CAPABILITY_RESOURCE_POLICY"
alexa-skills-kit-color-expert,arn:aws:serverlessrepo:us-east-1:077246666028:applications/alexa-skills-kit-color-expert,AWS,598,,Demonstrates a basic skill built with the Amazon Alexa Skills Kit.,https://github.com/aws-samples/serverless-app-examples/tree/master/javascript/alexa-skills-kit-color-expert,
standard-redirects-for-cloudfront,arn:aws:serverlessrepo:us-east-1:621073008195:applications/standard-redirects-for-cloudfront,Digital Sailors,552,"CloudFront,Redirects,Website","A Lambda@Edge function that implements standard web server redirects that simplify directory handling. It handles ""internal"" redirects from /foo/ to /foo/index.html and ""external"" redirects from /foo/index.html to /foo/.
",https://github.com/digital-sailors/standard-redirects-for-cloudfront,
aws-deployment-framework,arn:aws:serverlessrepo:us-east-1:112893979820:applications/aws-deployment-framework,AWS ADF Builders Team,516,"adf,devops,cicd,aws-deployment-framework,multi-account",The AWS Deployment Framework (ADF) is an extensive and flexible framework to manage and deploy resources across multiple AWS accounts and regions based on AWS Organizations.,https://github.com/awslabs/aws-deployment-framework,"CAPABILITY_NAMED_IAM,CAPABILITY_RESOURCE_POLICY"
Datadog-RDS-Enhanced,arn:aws:serverlessrepo:us-east-1:464622532012:applications/Datadog-RDS-Enhanced,Datadog,481,"rds,enhanced,datadog,metrics,logs","The Datadog RDS enhanced monitoring application collects granular operating system level metrics from CloudWatch logs and sends them to Datadog for alerting, dashboarding, and analyzing.",,
api-gateway-dev-portal,arn:aws:serverlessrepo:us-east-1:563878140293:applications/api-gateway-dev-portal,Amazon API Gateway,466,,"api-gateway-dev-portal is a developer portal application that allows users to register, discover, and subscribe to your API Products (via API Gateway Usage Plans), manage their API Keys, and view their usage metrics for your APIs.",https://github.com/awslabs/aws-api-gateway-developer-portal,"CAPABILITY_NAMED_IAM,CAPABILITY_RESOURCE_POLICY"
uploader,arn:aws:serverlessrepo:us-east-1:233054207705:applications/uploader,evan chiu,443,"s3,web-app,upload,nodejs",Serverless web application for uploading files to S3,https://github.com/evanchiu/serverless-galleria,
hello-world-python3,arn:aws:serverlessrepo:us-east-1:077246666028:applications/hello-world-python3,AWS,434,,A started hello-world serverless application in python3,https://github.com/aws-samples/serverless-app-examples/tree/master/python/hello-world-python3,
SecretsManagerRDSOracleRotationSingleUser,arn:aws:serverlessrepo:us-east-1:297356227824:applications/SecretsManagerRDSOracleRotationSingleUser,AWS Secrets Manager,421,,Conducts an AWS SecretsManager secret rotation for RDS Oracle using the single user rotation scheme,,"CAPABILITY_IAM,CAPABILITY_RESOURCE_POLICY"
SecretsManagerRDSPostgreSQLRotationMultiUser,arn:aws:serverlessrepo:us-east-1:297356227824:applications/SecretsManagerRDSPostgreSQLRotationMultiUser,AWS Secrets Manager,413,,Conducts an AWS SecretsManager secret rotation for RDS PostgreSQL using the multiple user rotation scheme,,"CAPABILITY_IAM,CAPABILITY_RESOURCE_POLICY"
api-lambda-send-email-ses,arn:aws:serverlessrepo:us-east-1:375983427419:applications/api-lambda-send-email-ses,Aleksandar Simovic,412,"ses,lambda,simple,api,send,email","This is a serverless component which sends an email to specified email addresses. Supports HTML and Text emails. Consists of an API that receives data, sends it to your Lambda function which uses SES to send the email. Supports CORS. Written in Node.js.",https://github.com/simalexan/api-lambda-send-email-ses,
api-lambda-save-dynamodb,arn:aws:serverlessrepo:us-east-1:375983427419:applications/api-lambda-save-dynamodb,Aleksandar Simovic,394,"lambda,save,api,nodejs,store,dynamodb,put","This is an serverless component consisting of a Lambda function, API Gateway and a DynamoDB table. Its API Gateway receives request data, sends it to your Lambda function which saves request data to a DynamoDB table. Supports CORS. Written in Node.js. ",https://github.com/simalexan/api-lambda-save-dynamodb,
image-magick-lambda-layer,arn:aws:serverlessrepo:us-east-1:145266761615:applications/image-magick-lambda-layer,Gojko Adzic,376,"image,lambda,layer,imagemagick","Static build of ImageMagick for Amazon Linux 2, packaged as a Lambda layer. Bundles ImageMagick 7.0.8-45.
Including convert, mogrify and identify tools and support for jpeg, gif, png, tiff and webm formats.
",https://github.com/serverlesspub/imagemagick-aws-lambda-2,
alexa-skills-kit-nodejs-hello-world,arn:aws:serverlessrepo:us-east-1:247115765381:applications/alexa-skills-kit-nodejs-hello-world,Sohan Maheshwar,369,"skill,alexa","This is a simple Hello World Alexa skill

This tutorial will walk first-time Alexa skills developers through all the required steps involved in creating a skill using this hello world template, called ‘hello world’. ",https://github.com/alexa/skill-sample-nodejs-hello-world,
serverless-todo,arn:aws:serverlessrepo:us-east-1:233054207705:applications/serverless-todo,evanchiu,363,"todo,lambda,api-gateway,react,nodejs,dynamodb",React TodoMVC with a Serverless backend,https://github.com/evanchiu/serverless-todo,
hello-world-python,arn:aws:serverlessrepo:us-east-1:077246666028:applications/hello-world-python,AWS,341,,A starter hello-world serverless application in python,https://github.com/aws-samples/serverless-app-examples/tree/master/python/hello-world-python,
https-request,arn:aws:serverlessrepo:us-east-1:077246666028:applications/https-request,AWS,336,,Demonstrates using a built-in Node.js module to make an HTTPS request.,https://github.com/aws-samples/serverless-app-examples/tree/master/javascript/https-request,
NewRelic-log-ingestion,arn:aws:serverlessrepo:us-east-1:463657938898:applications/NewRelic-log-ingestion,New Relic,335,"rds,enhanced,lambda,log,vpc,logging,ingestion,monitoring,newrelic,flowlogs",Send log data from CloudWatch Logs and S3 to New Relic Infrastructure (Cloud Integrations) and New Relic Logging.,https://github.com/newrelic/aws-log-ingestion,CAPABILITY_RESOURCE_POLICY
AthenaCloudwatchConnector,arn:aws:serverlessrepo:us-east-1:292517598671:applications/AthenaCloudwatchConnector,Amazon Athena Federation,324,athena-federation,"This connector enables Amazon Athena to communicate with Cloudwatch, making your logs accessible via SQL.",https://github.com/awslabs/aws-athena-query-federation,CAPABILITY_IAM
alexa-skills-kit-nodejs-basic-welcome,arn:aws:serverlessrepo:us-east-1:035042475088:applications/alexa-skills-kit-nodejs-basic-welcome,Suneet M Patil,315,"suneet,alexa-skills-kit,alexa,basic-welcome",Demonstrate a Basic Lambda Welcome skill built with the ASK NodeJS SDK,https://github.com/SuneetPatil/Alexa-Basic-Welcome,
SecretsManagerRedshiftRotationSingleUser,arn:aws:serverlessrepo:us-east-1:297356227824:applications/SecretsManagerRedshiftRotationSingleUser,AWS Secrets Manager,290,,Conducts an AWS SecretsManager secret rotation for Amazon Redshift using the single user rotation scheme,https://github.com/aws-samples/aws-secrets-manager-rotation-lambdas,"CAPABILITY_IAM,CAPABILITY_RESOURCE_POLICY"
dynamodb-elasticsearch,arn:aws:serverlessrepo:us-east-1:831212071815:applications/dynamodb-elasticsearch,Kwun-Hok Chan,277,"elasticsearch,AWS,sample,dynamodb",An example AWS Lambda function to index records from DynamoDB to ElasticSearch.,,
ffmpeg-lambda-layer,arn:aws:serverlessrepo:us-east-1:145266761615:applications/ffmpeg-lambda-layer,Gojko Adzic,252,"lambda,ffprobe,ffmpeg,layer","Static build of FFmpeg/FFprobe for Amazon Linux 2, packaged as a Lambda layer. Bundles FFmpeg 4.1.3
",https://github.com/serverlesspub/ffmpeg-aws-lambda-layer,
ALB-Lambda-Target-HelloWorld,arn:aws:serverlessrepo:us-east-1:072567720793:applications/ALB-Lambda-Target-HelloWorld,AWS Elastic Load Balancing,248,"Target,lambda,alb,ALB,Lambda,target",HelloWorld Lambda function template for Application Load Balancer Lambda as target,https://github.com/aws/elastic-load-balancing-tools/tree/master/application-load-balancer-serverless-app/helloworld,
AmazonConnectSalesforceLambda,arn:aws:serverlessrepo:us-east-1:680944752362:applications/AmazonConnectSalesforceLambda,AmazonConnectSalesforceIntegration,247,"Integration,Connect,Amazon,Salesforce","The AWS Serverless application package contains a set of common Lambda functions to be used by Amazon Connect to interact with Salesforce, allowing lookup, create and update operations for different Salesforce objects, like Contacts and Cases.",https://github.com/AmazonConnectSalesforceIntegration/AmazonConnectSalesforceLambda,CAPABILITY_IAM
cloudfront-response-generation,arn:aws:serverlessrepo:us-east-1:077246666028:applications/cloudfront-response-generation,AWS,240,,Sample application for generating a response from viewer-request trigger implemented in NodeJS.,https://github.com/aws-samples/serverless-app-examples/tree/master/javascript/cloudfront-response-generation,
dynamodb-display,arn:aws:serverlessrepo:us-east-1:251940851769:applications/dynamodb-display,Jagsp,229,"lambda,api-gateway,dynamodb",This is a dynamic s3 website which uses API gateway and Lambda to scan a Dynamodb Table and displays in tabular format.,,
sumologic-guardduty-events-processor,arn:aws:serverlessrepo:us-east-1:956882708938:applications/sumologic-guardduty-events-processor,AppDev Team,224,"lambda,sumologic,cloudwatchevents,guardduty",This solution creates resources for processing and sending Amazon GuardDuty Events to Sumo logic.,https://github.com/SumoLogic/sumologic-aws-lambda/,
cloudfront-authorization-at-edge,arn:aws:serverlessrepo:us-east-1:520945424137:applications/cloudfront-authorization-at-edge,AWS Samples,220,"cognito,s3,angular,lambda@edge,vue,react,cloudfront,amplify","Protect downloads of your content hosted on CloudFront with Cognito authentication using Lambda@Edge. Includes: S3 Bucket w. sample SPA, Cognito User Pool with hosted UI set up, Lambda@Edge functions to validate JWT's and handle OAuth2 redirects.
",https://github.com/aws-samples/cloudfront-authorization-at-edge,"CAPABILITY_IAM,CAPABILITY_RESOURCE_POLICY"
hello-go-serverless-webapp,arn:aws:serverlessrepo:us-east-1:713541911133:applications/hello-go-serverless-webapp,Drew Dresser,209,"lambda,go,api-gateway,api",A getting started application to deploy an API with API Gateway and a Lambda written in Go.,https://github.com/drewdresser/hello-go-serverless-webapp,
SecretsManagerRotationTemplate,arn:aws:serverlessrepo:us-east-1:297356227824:applications/SecretsManagerRotationTemplate,AWS Secrets Manager,208,,Creates a templated lambda to be used by AWS SecretsManager for secret rotation,,"CAPABILITY_IAM,CAPABILITY_RESOURCE_POLICY"
acloudguru-alexadevs-triviaskill,arn:aws:serverlessrepo:us-east-1:255532471201:applications/acloudguru-alexadevs-triviaskill,Nick Triantafillou,200,"acloudguru,alexa","Used in episode 3 of ""Alexa Devs"" - a series to learn how to develop alexa skills",http://acloud.guru,
WebScraper,arn:aws:serverlessrepo:us-east-1:339543757547:applications/WebScraper,ryfeus,192,"scraping,selenium,phantomJS,parse,web-scraping","
Selenium on PhantomJS. In fact - a ready-made tool for web scraping. For example, the demo parses a random page in Wikipedia and sends its header. (PhantomJS at the same time disguises as a normal browser, knows how to log in, click and fill out forms) ",,
s3-lambda-save-dynamodb,arn:aws:serverlessrepo:us-east-1:375983427419:applications/s3-lambda-save-dynamodb,Aleksandar Simovic,173,"s3,lambda,file,save,nodejs,event,dynamodb,put","This is a S3 Lambda that listens to an event when a file is stored in a S3 Bucket. It then saves information about the stored file in a DynamoDB table.
Written in Node.js. It's a Nuts & Bolts application component for AWS Serverless Application Repository.",https://github.com/simalexan/s3-lambda-save-dynamodb,
lambda-to-slack,arn:aws:serverlessrepo:us-east-1:289559741701:applications/lambda-to-slack,Keeton Hodgson,173,"lambda,slack,serverless",Posts messages to a Slack channel.,https://github.com/keetonian/lambda-to-slack,
image-processing-service,arn:aws:serverlessrepo:us-east-1:077246666028:applications/image-processing-service,AWS,171,"ImageMagick,AWS,sample","Uses ImageMagick to perform simple image processing operations, such as resizing.",https://github.com/aws-samples/serverless-app-examples/tree/master/javascript/image-processing-service,
cloudwatch-alarm-to-slack,arn:aws:serverlessrepo:us-east-1:077246666028:applications/cloudwatch-alarm-to-slack,AWS,168,"CloudWatch,SNS,trigger,AWS,sample",Serverless application that sends CloudWatch alarm notifications to Slack on an Amazon SNS trigger,https://github.com/aws-samples/serverless-app-examples/tree/master/javascript/cloudwatch-alarm-to-slack,
AthenaDynamoDBConnector,arn:aws:serverlessrepo:us-east-1:292517598671:applications/AthenaDynamoDBConnector,Amazon Athena Federation,168,athena-federation,"This connector enables Amazon Athena to communicate with DynamoDB, making your tables accessible via SQL.",https://github.com/awslabs/aws-athena-query-federation,CAPABILITY_IAM
s3-uncompressor,arn:aws:serverlessrepo:us-east-1:180876865127:applications/s3-uncompressor,Piotr Mlocek,165,"zip,s3,decompress,uncompress,unzip,compression",Automatically uncompresses (or decompresses) files uploaded to selected S3 bucket!,,
serverless-survey,arn:aws:serverlessrepo:us-east-1:194383749778:applications/serverless-survey,Tomasz Stachlewski,160,"lambda,survey,serverless,html,dynamodb","Thanks to this application, you will be to quickly generate your own serverless survey. Just fill out configuration file with questions which should be part of the survey and save your app. In just a few seconds, your survey will be available!",,
hello-world-go,arn:aws:serverlessrepo:us-east-1:831212071815:applications/hello-world-go,Kwun-Hok Chan,155,"go,hello-world,aws,sample","A sample hello world Lambda application written in Go, using eawsy/aws-lambda-go-shim.",,
s3-get-object,arn:aws:serverlessrepo:us-east-1:077246666028:applications/s3-get-object,AWS,153,,An Amazon S3 trigger that retrieves metadata for the object that has been updated.,https://github.com/aws-samples/serverless-app-examples/tree/master/javascript/s3-get-object,CAPABILITY_IAM
sqs-poller,arn:aws:serverlessrepo:us-east-1:077246666028:applications/sqs-poller,AWS,152,,Periodically polls an SQS queue and asynchronously consumes each message.,https://github.com/aws-samples/serverless-app-examples/tree/master/javascript/sqs-poller,
simple-mobile-backend,arn:aws:serverlessrepo:us-east-1:077246666028:applications/simple-mobile-backend,AWS,149,,A simple mobile backend (read/write to DynamoDB).,https://github.com/aws-samples/serverless-app-examples/tree/master/javascript/simple-mobile-backend,
Tesseract,arn:aws:serverlessrepo:us-east-1:339543757547:applications/Tesseract,ryfeus,144,"tesseract,recognition,ocr,ml",Tesseract is OCR recognition library which allows to get text from given image.,https://github.com/ryfeus/lambda-packs,
DVSA,arn:aws:serverlessrepo:us-east-1:889485553959:applications/DVSA,OWASP,143,"coding,security,hacking,protego,owasp,serverless,vulnerabilities,training,secure,dvsa","Damn Vulnerable Serverless Application (DVSA) is a deliberately vulnerable app made to help serverless security professionals and developers, better understand the processes and implications of serverless security in a legal, controlled environment.",https://www.owasp.org/index.php/OWASP_DVSA,"CAPABILITY_NAMED_IAM,CAPABILITY_RESOURCE_POLICY"
api-gateway-authorizer-nodejs,arn:aws:serverlessrepo:us-east-1:077246666028:applications/api-gateway-authorizer-nodejs,AWS,140,api-gateway,"A sample application for API Gateway custom authorizers, implemented in NodeJS.",https://github.com/aws-samples/serverless-app-examples/tree/master/javascript/api-gateway-authorizer-nodejs,
Contact-Us,arn:aws:serverlessrepo:us-east-1:132093761664:applications/Contact-Us,Randy Findley,139,"lambda,website,static,api-gateway,recaptcha,sns,contact-us","Need a ""contact us"" form on your static website?  

This template uses API Gateway, Lambda, and SNS to create a Serverless ""contact us"" form for your static website.",https://github.com/rgfindl/serverless-contact-us-form,
amazon-cognito-passwordless-email-auth,arn:aws:serverlessrepo:us-east-1:520945424137:applications/amazon-cognito-passwordless-email-auth,AWS Samples,139,"cognito,passwordless,auth,sample,authentication","An Amazon Cognito user pool, pre-configured with AWS Lambda triggers to implement passwordless e-mail auth
",https://github.com/aws-samples/amazon-cognito-passwordless-email-auth/tree/master/cognito,"CAPABILITY_IAM,CAPABILITY_RESOURCE_POLICY"
lambda-web-page-example,arn:aws:serverlessrepo:us-east-2:494028075635:applications/lambda-web-page-example,Chris Lennon,137,,This component creates an API Gateway endpoint that is linked to a Lambda function that returns HTML (i.e. page can be viewed in a web browser),https://github.com/cjlennon-dev/lambda-web-page-example,
SecretsManagerRDSSQLServerRotationSingleUser,arn:aws:serverlessrepo:us-east-1:297356227824:applications/SecretsManagerRDSSQLServerRotationSingleUser,AWS Secrets Manager,137,,Conducts an AWS SecretsManager secret rotation for RDS SQL Server using the single user rotation scheme,,"CAPABILITY_IAM,CAPABILITY_RESOURCE_POLICY"
alexa-anagram,arn:aws:serverlessrepo:us-east-1:233054207705:applications/alexa-anagram,evanchiu,136,"anagram,alexa,nodejs",Alexa responds with the count and anagrams for a requested word,https://github.com/evanchiu/alexa-anagram,
serverless-cognito,arn:aws:serverlessrepo:us-east-1:517266833056:applications/serverless-cognito,Marek Kuczynski,135,"cognito,lambda,api,login","Authenticate your users through Cognito, Lambda and API Gateway. The script will set a local cookie in the browser and prompt for reauthentication by the user if needed. 

More information; https://github.com/marekq/serverless-cognito
",https://github.com/marekq/serverless-cognito,CAPABILITY_IAM
serverless-goat,arn:aws:serverlessrepo:us-east-1:761130837472:applications/serverless-goat,OWASP,135,"security,vulnerable,owasp,serverless","OWASP ServerlessGoat is a deliberately insecure realistic AWS Lambda serverless application, maintained by OWASP and initially created by PureSec.",https://www.owasp.org/index.php/OWASP_Serverless_Goat,
sns-message,arn:aws:serverlessrepo:us-east-1:077246666028:applications/sns-message,AWS,131,,An Amazon SNS trigger that logs the message pushed to the SNS topic.,https://github.com/aws-samples/serverless-app-examples/tree/master/javascript/sns-message,
SecretsManagerMongoDBRotationSingleUser,arn:aws:serverlessrepo:us-east-1:297356227824:applications/SecretsManagerMongoDBRotationSingleUser,AWS Secrets Manager,131,,Conducts an AWS SecretsManager secret rotation for MongoDB using the single user rotation scheme,https://github.com/aws-samples/aws-secrets-manager-rotation-lambdas,"CAPABILITY_IAM,CAPABILITY_RESOURCE_POLICY"
signalfx-lambda-example-nodejs,arn:aws:serverlessrepo:us-east-1:134183635603:applications/signalfx-lambda-example-nodejs,SignalFx,125,"signalfx,metrics,realtime,wrapper",Example of sending metrics from NodeJs Lambda using SignalFx Wrapper to SignalFx in real-time.,,
tic-tac-toe,arn:aws:serverlessrepo:us-east-1:459069303489:applications/tic-tac-toe,hiroki8080,125,"python3,game,sample","This is a serverless little game sample.
You can play games with two players via different browsers.
It uses that the temporary data is held within the time-out period.",https://github.com/hiroki8080/tic-tac-toe,
