test-sam,arn:aws:serverlessrepo:us-east-1:472311553902:applications/test-sam,test,2,tests,hello world,https://github.com/test/test,
platform-authorizer,arn:aws:serverlessrepo:us-east-1:820870426321:applications/platform-authorizer,Christopher Osborn,2,"lambda,auth0,authorizer,oauth2,cimpress,authentication",A Lambda Authorizer that can perform authentication for services on the Cimpress Mass Customization Platform.,https://github.com/Cimpress-MCP/Platform-Authorizer,
lambda-edge-logs-aggregator,arn:aws:serverlessrepo:us-east-1:085576722239:applications/lambda-edge-logs-aggregator,Danil Smirnov,2,"edge,lambda@edge,logging,cloudwatch,cloudfront,logs",Aggregate cross-region Lambda@Edge logs into one CloudWatch log group,https://github.com/danil-smirnov/lambda-edge-logs-aggregator,"CAPABILITY_IAM,CAPABILITY_RESOURCE_POLICY"
lambda-image-blur,arn:aws:serverlessrepo:us-east-1:517266833056:applications/lambda-image-blur,Marek Kuczynski,2,"faces,rekognition",A demopage to demonstrate how faces in pictures can be blurred using Amazon Rekognition. You will have access to your own blurring service running behind an API Gateway which you can use as a base for your own anonymizing solution.,https://github.com/marekq/,CAPABILITY_IAM
signed-links-cognito,arn:aws:serverlessrepo:us-east-1:278937263884:applications/signed-links-cognito,Alexey Vidanov,2,"cognito,s3,access,restricted,signed,links,api,cloudfront,secure,gateway",Generate signed links for CloudFormation<->S3 sources,https://github.com/vidanov/lambda-nodejs-signed-links,
aws-serverless-financial-functions-ppmt,arn:aws:serverlessrepo:us-east-1:077246666028:applications/aws-serverless-financial-functions-ppmt,AWS,2,"AWS,Lambda,finance,excel,financial-functions","Serverless app wrapping common financial function PPMT (payment on the principal for a given investment based on periodic, constant payments and a constant interest rate)",https://github.com/awslabs/aws-serverless-financial-functions,
sumologic-jfrog-xray,arn:aws:serverlessrepo:us-east-1:956882708938:applications/sumologic-jfrog-xray,Sumo Logic,2,"lambda,sumologic,serverless,JFrogXray",This solution consists of a lambda functions which is used to fetch logs from JFrogXray and ingest to Sumo Logic.,https://github.com/SumoLogic/sumologic-jfrog-xray,CAPABILITY_IAM
ExcelLexBot,arn:aws:serverlessrepo:us-east-1:111964674713:applications/ExcelLexBot,Cyrus Wong,2,Lex,ExcelLexBot is a serverless application that converts an Excel file (xlsx) in predefined format into an Amazon Lex chatbot.,https://github.com/wongcyrus/ExcelLexBot,CAPABILITY_IAM
FileLogTracker,arn:aws:serverlessrepo:us-east-1:551250655555:applications/FileLogTracker,turja-chaudhuri,2,"S3,DynamoDB","This is a serverless application which will respond to any event in a specified source bucket , and log the file details in a DynamoDB Table for tracking purposes.",www.linkedin.com/in/turjac591,
StreamData-IO-Github-Org-Events,arn:aws:serverlessrepo:us-east-1:879370021840:applications/StreamData-IO-Github-Org-Events,Streamdata-IO,2,"s3,streaming,github,data,organizations,api,lake,events","This streams all new events from a Github Organization using Streamdata.io, pulling data via the API and turning it into a stream and publishing the results to an Amazon S3 data lake.",http://www.streamdata.io,
MedPal,arn:aws:serverlessrepo:us-east-1:253417629174:applications/MedPal,Sayak Kundu,2,"nodejs,dynamodb,lambda,aws,medicine,routine,alexa,report,doctor,health",Med Pal helps you take control of your medicine intake and provides you with report of missed medicine. Also as an app a good example of Dynamo DB usage.,https://github.com/sayak119/MedPal,
text2event,arn:aws:serverlessrepo:us-east-1:215961008274:applications/text2event,huifeng chen,2,"data,wikipedia,wrangler,events","extract events from wikipedia
parameter:
lang:string: {""en"", ""zh""}
keyword:string: ""human""",https://github.com/josherich/text2event,
aws-serverless-financial-functions-mirr,arn:aws:serverlessrepo:us-east-1:077246666028:applications/aws-serverless-financial-functions-mirr,AWS,2,"AWS,Lambda,finance,excel,financial-functions","Serverless app wrapping common financial function MIRR (internal rate of return for a series of periodic cash flows, considering both cost of investment and interest on reinvestment of cash)",https://github.com/awslabs/aws-serverless-financial-functions,
sumologic-aws-cloudtrail-benchmark,arn:aws:serverlessrepo:us-east-1:956882708938:applications/sumologic-aws-cloudtrail-benchmark,Sumo Logic,2,"sumologic,serverless,cloudtrailbenchmark,security,benchmark,cloudtrail","This solution creates a trail which exports logs to a S3 bucket which are picked up by Sumo Logic's hosted collector. All the sumologic resources like collector, source and app folders are automatically created.",https://github.com/SumoLogic/sumologic-aws-lambda,"CAPABILITY_AUTO_EXPAND,CAPABILITY_NAMED_IAM,CAPABILITY_RESOURCE_POLICY"
Cleaner,arn:aws:serverlessrepo:us-east-1:484597657167:applications/Cleaner,Verdi March,2,"asg,ec2,autoscaling,clean","This SAM automates the cleaning-up of AWS resources created by EC2 instances that are members of an ASG, to prevent those resources from lingering forever in your AWS account.",https://github.com/verdimrc/sam-cleaner,
video-stabilization,arn:aws:serverlessrepo:us-east-1:932998628582:applications/video-stabilization,Rob Rose,2,"s3,computer-vision,python,opencv",An Amazon S3 trigger that uses OpenCV and Python to stabilize videos and upload it to another bucket.,https://github.com/RobRoseKnows/serverless-repo/,
codepipeline-s3-objects-public-read,arn:aws:serverlessrepo:us-east-1:068896461592:applications/codepipeline-s3-objects-public-read,Sam Dengler,2,"codepipeline,s3",A Lambda function triggered by CodePipeline to update the S3 ACL to Public Read for objects deployed via S3 Deploy action.,https://github.com/samdengler/codepipeline-s3-objects-public-read,
detect-stack-drifts,arn:aws:serverlessrepo:us-east-1:703976800898:applications/detect-stack-drifts,daisuke-awaji,2,cloudformation,"This funciton detects whether Cloudformation's Stack-related resource has been changed from the AWS console.

It starts every day at 10 o'clock and executes the detect_stack_drift API for all stacks.",https://github.com/daisuke-awaji/detect-stack-drift,CAPABILITY_NAMED_IAM
cloudwatch-alarms-macro,arn:aws:serverlessrepo:us-east-1:374852340823:applications/cloudwatch-alarms-macro,Lumigo,2,"lambda,cloudwatch,alarms,monitoring","Creates a macro that can auto-generate CloudWatch Alarms for API Gateway, Lambda, SQS and Step Functions.",https://github.com/lumigo/SAR-cloudwatch-alarms-macro,CAPABILITY_IAM
test-sam-publish,arn:aws:serverlessrepo:us-east-1:706286027993:applications/test-sam-publish,qwang,2,,hello,,
basic-oauth,arn:aws:serverlessrepo:us-east-1:052579446135:applications/basic-oauth,Jeff Demuth,2,oauth,"Parse feeds on social media websites, easy to port for other oauth implementations.  To get started create an app with whichever site and get a key and secret.  Paste the key, secret, oauth url and api url into os environment variables.
",https://www.jeffdemuth.com,
exif-reader,arn:aws:serverlessrepo:us-east-1:790194644437:applications/exif-reader,Milan Cermak,1,"EXIF,geojson,image,geospatial,location","The application extracts EXIF data from images and any other documents containing EXIF data and stores it into a DynamoDB table for easy access. If the input file is geo-tagged, the application stores the coordinate, enabling easy geospacial queries",https://github.com/milancermak/aws-lambda-exif-reader,
kim-demo2,arn:aws:serverlessrepo:us-east-1:584518143473:applications/kim-demo2,Kim,1,,demo usage.,https://github.com/humank/sam-local-demo,
CitizenDispatch,arn:aws:serverlessrepo:us-east-1:243352632475:applications/CitizenDispatch,Citizen Dispatch,1,"dispatch,web,emergency,react,disaster-response",Citizen Dispatch is a platform for coordinating emergency response efforts among citizen volunteers.,https://github.com/CitizenDispatch/citizen-dispatch-service,
lambda-edge-header-adder-python,arn:aws:serverlessrepo:us-east-1:777867517050:applications/lambda-edge-header-adder-python,Immanuel Potter,1,"headers,python,lambda,security,cache,response,origin,header,serverless,cloudfront","Function in Python3.7, partly to test integration of Lambda@Edge for Python, when announced.
Adds headers to CloudFront origin responses, improving security posture for serverless-hosted applications.",https://github.com/immanuelpotter/lambda-edge-header-adder,CAPABILITY_IAM
splunk-logging,arn:aws:serverlessrepo:us-east-1:501561212468:applications/splunk-logging,Chris Farris,1,,Splunk HEC Serverless Application,https://www.chrisfarris.com/,
timestamp-custom-resource,arn:aws:serverlessrepo:us-east-1:277187709615:applications/timestamp-custom-resource,James Hood,1,"serverless,custom-resource,examples",This example serverless application creates a custom resource that returns a timestamp as an ISO 8601 string.,https://github.com/jlhood/timestamp-custom-resource,
S3-Auto-transcriber-and-sentiment-analyzer,arn:aws:serverlessrepo:us-east-1:526237104669:applications/S3-Auto-transcriber-and-sentiment-analyzer,James Beswick AWS Serverless,1,"s3,comprehend,transcribe,dynamodb,lambda,reinvent","The S3 Auto-transcriber and sentiment analyzer will automatically convert uploaded MP3 files into transcribed text, using Amazon Transcribe. The resulting text is used to run a sentiment analysis with AWS Comprehend, and then store the result in DynamoDB.",https://github.com/jbesw/sar-s3-auto-transcriber,CAPABILITY_IAM
s3-to-dynamodb-importer,arn:aws:serverlessrepo:us-east-1:526237104669:applications/s3-to-dynamodb-importer,James Beswick AWS Serverless,1,"dynamodb,lambda,s3,import,serverless",The DynamoDB importer will automatically convert import a JSON array from an S3 object into Amazon DynamoDB.,https://github.com/jbesw/reinvent-svs214/tree/master/3-dynamodb,
s3-signed-urls,arn:aws:serverlessrepo:us-east-1:798398642570:applications/s3-signed-urls,Chris Coombs,1,"s3,api-gateway,signed",API Gateway access (GET/PUT) to S3 objects using signed URLs. This bypasses the API Gateway payload size limit of 10 MB.,https://github.com/chriscoombs/s3-signed-urls,
asg-event-to-datadog,arn:aws:serverlessrepo:us-east-1:641494176294:applications/asg-event-to-datadog,ServerlessOps,1,"datadog,autoscaling","Send ASG events to Datadog to help pinpoint issues caused by the scaling of a service.

Requires following parameters to be set which are obtained from the Datadog platform:

* DatadogApiKey
* DatadogAppKey
",https://github.com/ServerlessOpsIO/aws-asg-event-to-datadog/,
StreamData-IO-Github-Search-Repositories,arn:aws:serverlessrepo:us-east-1:879370021840:applications/StreamData-IO-Github-Search-Repositories,Streamdata-IO,1,"s3,streaming,github,search,data,repositories,api,lake","This streams a Github repositories search using Streamdata.io, pulling data via the API and turning it into a stream and publishing the results to an Amazon S3 data lake.",http://www.streamdata.io,
DisneyTokenService,arn:aws:serverlessrepo:us-east-1:514546153215:applications/DisneyTokenService,Allen-Michael Grobelny,1,,Retrieve an API token to use with Disney's API.,,
dynamodb-scaling-event-to-datadog,arn:aws:serverlessrepo:us-east-1:641494176294:applications/dynamodb-scaling-event-to-datadog,ServerlessOps,1,"datadog,autoscaling,dynamodb","Send DynamoDB scaling events to Datadog to pinpoint issues caused by the scaling of Tables.

Requires the following configuration from Datadog.

* DatadogApiKey
* DatadogAppKey

",https://github.com/ServerlessOpsIO/aws-dynamodb-scaling-event-to-datadog,
serverless-uptime-monitor,arn:aws:serverlessrepo:us-east-1:962675440091:applications/serverless-uptime-monitor,Fernando Dingler,1,"website,ping,http,availability,monitoring,uptime,status",Monitors an HTTP endpoint's availability with AWS Lambda and CloudWatch,https://github.com/ferdingler/lambda-watchtower,CAPABILITY_IAM
CopyToBucket,arn:aws:serverlessrepo:us-east-1:982831078337:applications/CopyToBucket,Andy Hopper,1,"S3,CloudFormation",This Lambda is designed to copy the contents from a publicly-accessible S3 bucket to another. Quite handy for copying static Web sites.,https://github.com/andyhopp/copy-to-bucket,CAPABILITY_IAM
APIDays-GraphQL,arn:aws:serverlessrepo:us-east-1:807166229097:applications/APIDays-GraphQL,Jose Ramon Huerga Ayuso,1,,Just a couple of APIs to be used as a playground with AWS App Sync,https://github.com/jrhuerga,CAPABILITY_IAM
detect-credential-compromise,arn:aws:serverlessrepo:us-east-1:658643464782:applications/detect-credential-compromise,Chris Farris,1,,Detect Credential Compromise,https://www.chrisfarris.com/,"CAPABILITY_IAM,CAPABILITY_RESOURCE_POLICY"
Route53-Backup,arn:aws:serverlessrepo:us-east-1:547005860389:applications/Route53-Backup,Andy Powell,1,"S3,Backup,Route53,DNS,Operations",An application to backup Route53 hosted zones into CloudFormation templates,https://github.com/aws-samples/amazon-route53-backup,"CAPABILITY_IAM,CAPABILITY_RESOURCE_POLICY"
chime-eks-top,arn:aws:serverlessrepo:us-east-1:273450712882:applications/chime-eks-top,Simon Woldemichael,1,"eks,chime,kubectl,chatops",Send the result of a `kubectl top nodes` from your AWS EKS cluster to an Amazon Chime room.,https://github.com/swoldemi/chime-eks-top,
dazn-lambda-powertools,arn:aws:serverlessrepo:us-east-1:570995107280:applications/dazn-lambda-powertools,DAZN,1,"lambda,powertools,nodejs,middleware,logging","An integrated suite of powertools for Lambda functions to make it easy for you to  implement structured logging, tracking correlation IDs, log sampling and much more.
",https://github.com/getndazn/dazn-lambda-powertools,
EpsagonPythonTemplate,arn:aws:serverlessrepo:us-east-1:066549572091:applications/EpsagonPythonTemplate,Epsagon,1,"serverless,lambda,aws-lambda,monitoring,tracing,observability,distributed-tracing,python",Gain serverless observability instantly! Use this template to enable Epsagon's distributed tracing engine with Python Lambdas ❤️,https://epsagon.com,
aws-serverless-financial-functions-nper,arn:aws:serverlessrepo:us-east-1:077246666028:applications/aws-serverless-financial-functions-nper,AWS,1,"AWS,Lambda,finance,excel,financial-functions","Serverless app wrapping common financial function NPER (number of periods for an investment based on periodic, constant payments and a constant interest rate)",https://github.com/awslabs/aws-serverless-financial-functions,
aws-serverless-financial-functions-irr,arn:aws:serverlessrepo:us-east-1:077246666028:applications/aws-serverless-financial-functions-irr,AWS,1,"AWS,Lambda,finance,excel,financial-functions",Serverless app wrapping common financial function IRR (internal rate of return for a series of cash flows),https://github.com/awslabs/aws-serverless-financial-functions,
disabling-access-for-inactive-IAM-users,arn:aws:serverlessrepo:us-east-1:062052777684:applications/disabling-access-for-inactive-IAM-users,LeanTaaS Inc,1,"lambda,sam,devops-made-easy,iam,security,LeanTaaS,compliance",Disabling access for inactive IAM user.,https://medium.com/@ajaya.loya/serverless-application-repository-sar-7bd72a044df7,CAPABILITY_IAM
StreamData-IO-Reddit-Search,arn:aws:serverlessrepo:us-east-1:879370021840:applications/StreamData-IO-Reddit-Search,Streamdata-IO,1,"streaming,reddit,search,data,lake,s3,api","This streams a Reddit search using Streamdata.io, pulling data via the API and turning it into a stream and publishing the results to an Amazon S3 data lake.",http://www.streamdata.io,
buildkite-serverless-agent,arn:aws:serverlessrepo:us-east-1:170889777468:applications/buildkite-serverless-agent,Mark Wolfe,1,"buildkite,ci","This project deploys a serverless buildkite agent which comprised of a bunch of AWS Lambda functions, an AWS codebuild project and an AWS stepfunction state machine which manages long running jobs.",https://github.com/wolfeidau/buildkite-serverless-agent,CAPABILITY_IAM
gaia-hub,arn:aws:serverlessrepo:us-east-1:820587342274:applications/gaia-hub,Blockstack PBC,1,"storage,gaia,blockstack,blockchain,bitcoin,ethereum,btc,blockstack-core","Gaia Decentralized storage for Blockstack apps

",https://github.com/blockstack/gaia/blob/master/README.md,"CAPABILITY_NAMED_IAM,CAPABILITY_RESOURCE_POLICY"
TwilioMessageReceiver,arn:aws:serverlessrepo:us-east-1:637546244970:applications/TwilioMessageReceiver,Richard Boyd,1,"SimpleNotificationService,SMS,SNS,Twilio,APIGateway","This application sets up an SNS topic and an API Gateway. API Gateway receives the Twilio formatted SMS message and converts it to json, then passes the message directly to SNS.",https://github.com/rhboyd/TwilioTemplate,"CAPABILITY_IAM,CAPABILITY_RESOURCE_POLICY"
daily-billing-report-to-slack,arn:aws:serverlessrepo:us-east-1:219018483479:applications/daily-billing-report-to-slack,sinofseven,1,"slack,billing",daily billing reprot to slack,https://github.com/sinofseven/sar-billing-report-to-slack,CAPABILITY_IAM
lambda-layer-aws-sdk-js,arn:aws:serverlessrepo:us-east-1:903779448426:applications/lambda-layer-aws-sdk-js,Pahud Hsieh,1,"layer,lambda,aws-sdk-js,node,aws",AWS Lambda Layer for node,https://github.com/pahud,
cloudwatch-logs-janitor,arn:aws:serverlessrepo:us-east-1:341255432068:applications/cloudwatch-logs-janitor,y0ssi10,1,"optimization,cloudwatch,logs",Applications to optimize the CloudWatch log groups,https://github.com/y0ssi10/cloudwatch-logs-janitor,CAPABILITY_IAM
test-crr,arn:aws:serverlessrepo:us-east-2:706286027993:applications/test-crr,qwang,1,,hello world,,
logs-insights-to-metric,arn:aws:serverlessrepo:us-east-1:085576722239:applications/logs-insights-to-metric,Danil Smirnov,1,"insights,cloudwatch,metrics,monitoring,logs",Publish data from CloudWatch Logs Insights to Custom Metrics,https://github.com/danil-smirnov/logs-insights-to-metric,"CAPABILITY_IAM,CAPABILITY_RESOURCE_POLICY"
Image-to-Textract-Response,arn:aws:serverlessrepo:us-east-1:312213527608:applications/Image-to-Textract-Response,Rayno Mostert,1,"textract,ocr",An application that uses the Textract API to detect text and tables in S3 Objects and stores the JSON response in an output S3 bucket.,https://github.com/RWMostert/image-to-textract-response,CAPABILITY_IAM
AthenaSQLITEConnector,arn:aws:serverlessrepo:us-east-1:689449560910:applications/AthenaSQLITEConnector,Damon Cortesi,1,"athena-federation,sqlite",Use Amazon Athena to query SQLite databases on Amazon S3,https://github.com/dacort/athena-sqlite,
lambci,arn:aws:serverlessrepo:us-east-1:553035198032:applications/lambci,LambCI,1,"continuous-integration,ci,git,github,build,lambda,lambci",A continuous integration system built on AWS Lambda,https://github.com/lambci/lambci,CAPABILITY_IAM
ImaguDA-Flood-Disaster-alert,arn:aws:serverlessrepo:us-east-1:666494974328:applications/ImaguDA-Flood-Disaster-alert,Luis de la Torre,1,"sns,dynamodb,iot",Imagu DA is an early flood/landslide alert tool that focuses on providing information about vulnerable population to human trafficking in the affected area.,https://gitlab.com/luis.delatorre/ImaguFORSocialGood,
sstest,arn:aws:serverlessrepo:us-east-2:371444783282:applications/sstest,sstest,1,,This is a test,www.google.com,
dynamodb-table-storage-metrics,arn:aws:serverlessrepo:us-east-1:790194644437:applications/dynamodb-table-storage-metrics,Milan Cermak,1,"cloudwatch,storage,metrics,dynamodb",This application exposes the storage size and item count of every DynamoDB table in a region as custom CloudWatch metrics. This allows you to monitor your DynamoDB usage.,https://github.com/milancermak/dynamodb-table-storage-metrics,CAPABILITY_IAM
lambda-logs-event-source,arn:aws:serverlessrepo:us-east-1:958845080241:applications/lambda-logs-event-source,Eric Allam,1,"logging,observability,lambda",A serverless app that processes JSON logs from Lambda & API Gateway CloudWatch logs and invokes a given function,https://github.com/solve-hq/lambda-logs-event-source,CAPABILITY_IAM
aws-console-sign-in-to-telegram,arn:aws:serverlessrepo:us-east-1:406883123076:applications/aws-console-sign-in-to-telegram,jeshan,1,telegram,Lets you know when people logs to a (private) Telegram group.,https://github.com/jeshan/aws-console-sign-in-to-telegram,CAPABILITY_IAM
serverless-test-2,arn:aws:serverlessrepo:us-east-1:633747021521:applications/serverless-test-2,Me,1,,test serverless,,
ALB-Lambda-Target-UploadFiletoS3,arn:aws:serverlessrepo:us-east-1:072567720793:applications/ALB-Lambda-Target-UploadFiletoS3,AWS Elastic Load Balancing,1,"ALB,Lambda,Target,alb,target,lambda",UploadFiletoS3 Lambda function template for Application Load Balancer Lambda as target,https://github.com/aws/elastic-load-balancing-tools/tree/master/application-load-balancer-serverless-app/uploadfile_to_s3,CAPABILITY_IAM
api-gateway-component,arn:aws:serverlessrepo:us-east-1:375983427419:applications/api-gateway-component,Aleksandar Simovic,1,"api,gateway,apigw,component,composable,attachable,configurable",This is a serverless component consisting of a composable API Gateway that is easily attachable to any Lambda you provide. The API Gateway receives request data and sends it to your Lambda function.,https://github.com/simalexan/api-gateway-component,CAPABILITY_RESOURCE_POLICY
api-lambda-send-templated-email-ses,arn:aws:serverlessrepo:us-east-1:375983427419:applications/api-lambda-send-templated-email-ses,Aleksandar Simovic,1,"lambda,send,templated,email,api,ses,template",This is a serverless component which sends a Templated Email to specified email addresses. Requires an existing SES Email Template. Consists of an API and a Lambda function which uses SES to send the email. Supports CORS. Written in Node.js.,https://github.com/simalexan/api-lambda-send-templated-email-ses,CAPABILITY_IAM
AthenaTPCDSConnector,arn:aws:serverlessrepo:us-east-1:292517598671:applications/AthenaTPCDSConnector,Amazon Athena Federation,1,athena-federation,This connector enables Amazon Athena to communicate with a randomly generated TPC-DS data source.,https://github.com/awslabs/aws-athena-query-federation,CAPABILITY_IAM
DailyQuotes,arn:aws:serverlessrepo:us-east-1:968061728685:applications/DailyQuotes,Abraham,1,"Daily,Quotes",DailyQuotes,https://github.com/tecmaverick/serverless-fortune-sms,
lambda-layer-mecab-python3,arn:aws:serverlessrepo:us-east-1:345513370492:applications/lambda-layer-mecab-python3,Kazuki Matsuda,1,"python3,lambda,mecab,layer",AWS Lambda Layer for MeCab,https://github.com/mats16/lambda-layer-mecab-python3,
age-nudity-recognizer,arn:aws:serverlessrepo:us-east-1:424961117306:applications/age-nudity-recognizer,Niza Siwale,1,"Age,Nudity",Age,https://github.com/dnsking/age_and_nudity_filter,
fstinfo,arn:aws:serverlessrepo:us-east-1:175313807745:applications/fstinfo,Kyle Goehner,1,"fst,openfst,fstinfo","This application creates an API Gateway endpoint for a lambda function for executing OpenFST's fstinfo tool.

http://www.openfst.org/twiki/bin/view/FST/WebHome",,
FoodForAll,arn:aws:serverlessrepo:us-east-1:668829368920:applications/FoodForAll,Umesh Andaluri,1,,See README for more information.,https://github.com/umesh327/food-for-all/blob/master/lambda/FoodForAllLex2RDS/README.md,
Update-Route53-Record-to-Ec2-PublicIp-Python3,arn:aws:serverlessrepo:us-east-1:884430845962:applications/Update-Route53-Record-to-Ec2-PublicIp-Python3,Aiden Kihyun Kim,1,"route53,python,ec2,fqdn,dns,cloudwatch,publicip",AWS Lambda function for updating Route53 record when public ip of EC2 instance.,https://github.com/aidenkihyunkim/aws-lambda-update-route53-record-to-ec2-public-ip-python3,CAPABILITY_IAM
aws-serverless-financial-functions-xnpv,arn:aws:serverlessrepo:us-east-1:077246666028:applications/aws-serverless-financial-functions-xnpv,AWS,1,"AWS,Lambda,finance,excel,financial-functions",Serverless app wrapping common financial function XNPV (net present value for a schedule of cash flows),https://github.com/awslabs/aws-serverless-financial-functions,
test2,arn:aws:serverlessrepo:us-east-1:408832444363:applications/test2,kevin,1,,fff,,
mechanicalrock-pipeline-dashboard,arn:aws:serverlessrepo:us-east-1:611781478414:applications/mechanicalrock-pipeline-dashboard,Mechanical Rock,1,"pipeline,code-pipeline,dashboard","Simple dashboard built for viewing pipeline metrics in AWS. 
Fork of https://github.com/stelligent/pipeline-dashboard
Shows trends of pipeline metrics over time",https://github.com/MechanicalRock/pipeline-dashboard,
awscallouts,arn:aws:serverlessrepo:us-east-1:111964674713:applications/awscallouts,Cyrus Wong,1,"amazon_connect,lex","AWS callout makes a batch outbound calls with Amazon Connect and Amazon Lex.  You just need to fill in an Excel file and upload a Excel file into S3. 
",https://github.com/wongcyrus/aws-callouts,"CAPABILITY_IAM,CAPABILITY_RESOURCE_POLICY"
ExpiryChecker,arn:aws:serverlessrepo:us-east-1:515986239557:applications/ExpiryChecker,Kalpit Pokra,0,"nodejs,dynamodb,lambda,expiry,checker",Expiry Checker is the answer to people forgetting about expiry date of items and thus degrading their own health in this hectic life. People usually forget to check expiry date for any item which eventually might cause more harm than good.,https://github.com/kalpit4088/Expiry-Checker,
serverless-data-pipeline,arn:aws:serverlessrepo:us-east-1:572738032487:applications/serverless-data-pipeline,Onur Yilmaz,0,"serverless,data,pipeline,python",This is a sample template for a serverless data pipeline.,https://github.com/onrylmz/serverless-datapipeline-aws-sam,CAPABILITY_IAM
