s3-lambda-ffmpeg-mov-to-mp4-s3,arn:aws:serverlessrepo:us-east-1:375983427419:applications/s3-lambda-ffmpeg-mov-to-mp4-s3,Aleksandar Simovic,14,"s3,lambda,ffmpg,video,convert,mov,mp4,nodejs","This is a serverless component that has an Input S3 bucket that accepts MOV video files, a Lambda function that uses FFMPEG Lambda Layer to convert MOV video file to MP4 and uploads to the Output S3 Bucket. Written in Node.js.",https://github.com/simalexan/s3-lambda-ffmpeg-mov-to-mp4-s3,
s3-lambda-csv-to-xlsx-s3,arn:aws:serverlessrepo:us-east-1:375983427419:applications/s3-lambda-csv-to-xlsx-s3,Aleksandar Simovic,14,"s3,lambda,convert,csv,xlsx,excel,parse","This is a serverless component that has an Input S3 bucket that accepts CSV files, a Lambda function that converts them to Microsoft Excel xlsx and uploads to the Output S3 Bucket. Written in Node.js.",https://github.com/simalexan/s3-lambda-csv-to-xlsx-s3,
Position,arn:aws:serverlessrepo:us-east-1:760301537001:applications/Position,HERE Technologies,14,"positioning,map",A Lambda function that provides positioning estimates based on global Wi-Fi and cell coverage using HERE Location Services.,https://aws.amazon.com/marketplace/pp/B07JPLG9SR/?ref=_ptnr_aws_sar,
macie-slack-notification,arn:aws:serverlessrepo:us-east-1:180876865127:applications/macie-slack-notification,Piotr Mlocek,14,"slack,macie,notification,cloudwatchevents",Sends notifications about new Amazon Macie alerts to a Slack channel.,,
algorithmia,arn:aws:serverlessrepo:us-east-1:077246666028:applications/algorithmia,AWS,14,,Run any algorithm in the Algorithmia marketplace.,https://github.com/aws-samples/serverless-app-examples/tree/master/javascript/algorithmia,
audio-to-mp3,arn:aws:serverlessrepo:us-east-1:831212071815:applications/audio-to-mp3,Kwun-Hok Chan,14,"s3,mp3,audio,aws",Converts any audio files uploaded to S3 to MP3,,
lambda-layer-headless-chromium,arn:aws:serverlessrepo:us-east-1:903779448426:applications/lambda-layer-headless-chromium,Pahud Hsieh,14,"headless,lambda,chrome,aws,layer",AWS Lambda Layer for Headless Chromium,https://github.com/pahud/lambda-layer-headless-chromium,
billingReports,arn:aws:serverlessrepo:us-east-1:754380202678:applications/billingReports,Octo Technology Australia,14,"Slack,report,OCTO,octo,AWS,billing",Delivers latest AWS costs breakdown to your Slack channel,https://www.octo.com/en,
iot-twitter-bridge,arn:aws:serverlessrepo:us-east-1:123940773876:applications/iot-twitter-bridge,TensorIoT,14,"twitter,aws-iot,iot",This service provides a bridge between AWS IoT and Twitter for your devices to tweet messages directly to Twitter. ,,
aws-private-ca-policy-venafi,arn:aws:serverlessrepo:us-east-1:497086895112:applications/aws-private-ca-policy-venafi,Venafi,14,"aws-certificate-manager,venafi-cloud,certificates,venafi-platform,tls,ssl",(UNDER DEVELOPMENT) Venafi Lambda functions for AWS that enforce enterprise security policy for the AWS Private CA.,https://github.com/Venafi/aws-private-ca-policy-venafi,
Traffic,arn:aws:serverlessrepo:us-east-1:760301537001:applications/Traffic,HERE Technologies,14,"here,map,traffic",A lambda function to display map tiles with real-time traffic flow information overlays reflected as colored lines drawn on affected streets and roads and get access to real-time traffic flow and incident data in XML and JSON.,https://aws.amazon.com/marketplace/pp/B07JPLG9SR/?ref=_ptnr_aws_sar,
aws-dynamodb-stream-eventbridge-fanout,arn:aws:serverlessrepo:us-east-1:646794253159:applications/aws-dynamodb-stream-eventbridge-fanout,AWS Serverless Application Repository,14,"eventbridge,serverless,dynamodb",This application forwards events from a DynamoDB stream into an EventBridge event bus.,https://github.com/awslabs/aws-dynamodb-stream-eventbridge-fanout,CAPABILITY_IAM
s3-cost-explorer,arn:aws:serverlessrepo:us-east-1:517266833056:applications/s3-cost-explorer,Marek Kuczynski,14,"s3,cost,costexplorer","Retrieve AWS cost reports through AWS Lambda which writes results to S3. You can then leverage Athena to create billing reports on demand.
",https://github.com/marekq/s3-cost-explorer,
inbound-ses-spam-filter-python,arn:aws:serverlessrepo:us-east-1:077246666028:applications/inbound-ses-spam-filter-python,AWS,14,"spam,filter,email,python,AWS,sample",A simple email filter for protection against spam and viruses as well as DKIM and SPF failures.,https://github.com/aws-samples/serverless-app-examples/tree/master/python/inbound-ses-spam-filter-python,
signalfx-enhanced-rds-metrics,arn:aws:serverlessrepo:us-east-1:134183635603:applications/signalfx-enhanced-rds-metrics,SignalFx,14,"enhanced,rds,realtime,metrics,signalfx",Parses enhanced RDS metrics from CloudWatch Logs and sends them to SignalFx.,https://github.com/signalfx/enhanced-rds-monitoring,
s3-lambda-markdown-to-html-s3,arn:aws:serverlessrepo:us-east-1:375983427419:applications/s3-lambda-markdown-to-html-s3,Aleksandar Simovic,13,"s3,lambda,convert,parse,markdown,html,pandoc,htm","This is a serverless component that has an Input S3 bucket that accepts Markdown files, a Lambda function that converts them to HTML and uploads to the Output S3 Bucket. Written in Node.js.",https://github.com/simalexan/s3-lambda-markdown-to-html-s3,
realworld-serverless-application,arn:aws:serverlessrepo:us-east-1:646794253159:applications/realworld-serverless-application,AWS Serverless Application Repository,13,"github,serverless,sam",This project is an adaptation of the AWS Serverless Application Repository. It's primary objective is to serve as a case study of how to build a production grade service using a combination of serverless technologies and approaches.,https://github.com/awslabs/realworld-serverless-application,"CAPABILITY_AUTO_EXPAND,CAPABILITY_NAMED_IAM,CAPABILITY_RESOURCE_POLICY"
realworld-serverless-application-analytics,arn:aws:serverlessrepo:us-east-1:646794253159:applications/realworld-serverless-application-analytics,AWS Serverless Application Repository,13,"firehose,glue,serverless,athena",This application creates analytics component for a backend service.,https://github.com/awslabs/realworld-serverless-application,"CAPABILITY_AUTO_EXPAND,CAPABILITY_NAMED_IAM,CAPABILITY_RESOURCE_POLICY"
realworld-serverless-application-static-website,arn:aws:serverlessrepo:us-east-1:646794253159:applications/realworld-serverless-application-static-website,AWS Serverless Application Repository,13,"github,serverless,sam",This application creates a static website that interacts with the backend service.,https://github.com/awslabs/realworld-serverless-application,"CAPABILITY_AUTO_EXPAND,CAPABILITY_RESOURCE_POLICY"
realworld-serverless-application-ops-dashboard,arn:aws:serverlessrepo:us-east-1:646794253159:applications/realworld-serverless-application-ops-dashboard,AWS Serverless Application Repository,13,"github,serverless,sam",This template creates CloudWatch dashboard for the backend service.,https://github.com/awslabs/realworld-serverless-application,
ChildInCrowd,arn:aws:serverlessrepo:us-east-1:256572818498:applications/ChildInCrowd,Horacio Canales,13,"children,ai,imagesrecognition,humantrafficking,computervision,rekognition,child",Protects children from kidnappers in a crowded event using artificial intelligence,childincrowd.org,
portable-serverless-app,arn:aws:serverlessrepo:us-east-1:024700040865:applications/portable-serverless-app,Danilo Poccia,13,"container,sqs,pattern,portable,api,gateway,queue,docker",A sample app that can run on AWS Lambda (using Amazon API Gateway or Amazon SQS) or as a web app (locally or in a Docker container).,https://github.com/danilop/portable-serverless-app,
api-gateway-multiple-origin-cors,arn:aws:serverlessrepo:us-east-1:077246666028:applications/api-gateway-multiple-origin-cors,AWS,13,api-gateway,Example of Multiple-Origin CORS using API Gateway and Lambda,https://github.com/awslabs/serverless-application-model/tree/master/examples/apps/api-gateway-multiple-origin-cors,
realworld-serverless-application-ops-alarm,arn:aws:serverlessrepo:us-east-1:646794253159:applications/realworld-serverless-application-ops-alarm,AWS Serverless Application Repository,13,"github,serverless,sam",This template creates CloudWatch alarms for the backend service.,https://github.com/awslabs/realworld-serverless-application,
Voice-Lexicon-API,arn:aws:serverlessrepo:us-east-1:762010787478:applications/Voice-Lexicon-API,Pavel Kral,13,,"This app powers voicelexicon.com where you can see it in action.

It accepts data from HTML form and generates MP3 so you can practice foreign language whenever you want.",https://github.com/pavelkraleu/aws-lambda-voicelexicon,
realworld-serverless-application-ops,arn:aws:serverlessrepo:us-east-1:646794253159:applications/realworld-serverless-application-ops,AWS Serverless Application Repository,13,"github,serverless,sam",This application creates alarms and dashboards for the backend service.,https://github.com/awslabs/realworld-serverless-application,CAPABILITY_AUTO_EXPAND
kinesis-analytics-process-record,arn:aws:serverlessrepo:us-east-1:077246666028:applications/kinesis-analytics-process-record,AWS,13,"Kinesis,transform,AWS,sample",An Amazon Kinesis Analytics record pre-processor that receives JSON or CSV records as input and returns them with a processing status. Use this processor as a starting point for custom transformation logic.,https://github.com/aws-samples/serverless-app-examples/tree/master/javascript/kinesis-analytics-process-record,
EventWriter,arn:aws:serverlessrepo:us-east-1:771389557967:applications/EventWriter,William Weiss,13,"events,s3",A serverless app that receives and stores events to an S3 bucket.,https://github.com/wweiss/aws-serverless-event-writer,
kinesis-firehose-apachelog-to-json-python,arn:aws:serverlessrepo:us-east-1:077246666028:applications/kinesis-firehose-apachelog-to-json-python,AWS,13,"Kinesis,Firehose,convertor,AWS,sample,python",An Amazon Kinesis Firehose stream processor that converts input records from Apache Common Log format to JSON.,https://github.com/aws-samples/serverless-app-examples/tree/master/python/kinesis-process-record-python,
eks-lambda-drainer,arn:aws:serverlessrepo:us-east-1:903779448426:applications/eks-lambda-drainer,Pahud Hsieh,13,"lambda,taint,autoscaling,lifecyclehook,eks,drain",Lambda handler for node draining on Amazon EKS spot instances,https://github.com/pahud/eks-lambda-drainer,CAPABILITY_NAMED_IAM
edge-router,arn:aws:serverlessrepo:us-east-1:903779448426:applications/edge-router,Pahud Hsieh,12,"nrt,router,edge,china,bjs,Lambda@Edge","edge-router is a simple demo that leverages the origin switch capabilities of Lambda@Edge. It will route traffic originated from China to Beijing Region API Gateway while other traffic to Tokoy API Gateway.
",,
getting-started-with-dynamodb-reviews-inserter,arn:aws:serverlessrepo:us-east-1:749224187782:applications/getting-started-with-dynamodb-reviews-inserter,William Kalescky,12,,"This application deploys a lambda function that is used to insert reviews into a table created during the ""Getting Started with DynamoDB"" blog post on the AWS Databases Blog",https://github.com/aws-samples/amazon-dynamodb-reviews-inserter-blog,CAPABILITY_IAM
png-to-jpeg-conversion,arn:aws:serverlessrepo:us-east-1:934629381695:applications/png-to-jpeg-conversion,Harsha Warrdhan Sharma,12,,"This stack triggers a lambda function upon upload of a .png object to a S3 bucket, which is also created during the stack creation.",,
kinesis-firehose-process-record,arn:aws:serverlessrepo:us-east-1:077246666028:applications/kinesis-firehose-process-record,AWS,12,,An Amazon Kinesis Firehose stream processor that accesses the records in the input and returns them with a processing status.,https://github.com/aws-samples/serverless-app-examples/tree/master/javascript/kinesis-firehose-process-record,
slack-invite,arn:aws:serverlessrepo:us-east-1:356769441913:applications/slack-invite,ACenterA,12,"slack,slack-invite,acentera,plugins","[ 0.0.17 ] - Slack Invitation App in Vue.JS
Including ReCaptcha validations and customizations. ",https://acentera.com/,
LightGBM,arn:aws:serverlessrepo:us-east-1:339543757547:applications/LightGBM,ryfeus,12,"scipy,boosting,decision,LightGBM,sklearn,tree,ranking,classification,ML","LightGBM (gradient boosting framework) for deploying ML models based on decision tree algorithms, used for ranking, classification and many other machine learning tasks. Also contains sklearn, scipy and numpy libs.",https://github.com/ryfeus/lambda-packs,
human-trafficking-facts,arn:aws:serverlessrepo:us-east-1:526127058206:applications/human-trafficking-facts,uday vissa,12,"skill,alexa,facts",to raise awareness for human trafficking,https://github.com/vvlabs/humantrafficking,
StreamData-IO-Twitter-Search,arn:aws:serverlessrepo:us-east-1:879370021840:applications/StreamData-IO-Twitter-Search,Streamdata-IO,12,"s3,streaming,twitter,search,data,api,lake","This streams a Twitter search using Streamdata.io, pulling data via the API and turning it into a stream and publishing the results to an Amazon S3 data lake.",http://www.streamdata.io,
aurora-api,arn:aws:serverlessrepo:us-east-1:233054207705:applications/aurora-api,evanchiu,12,"API,Aurora,Forecast,NOAA,nodejs",Provide an structured data API on top of NOAA's Aurora Forecast,https://github.com/evanchiu/aurora-api,
aws-support-bot,arn:aws:serverlessrepo:us-east-1:986516506659:applications/aws-support-bot,Mridula Grandhi,11,alexa-aws-support,"AWS Support Bot for Alexa with the following features:
1. Create AWS Support Case
2. Get AWS Support Case Status
3. Email AWS Support Case Report
",https://github.com/gmridula/aws-support-bot,
sepia,arn:aws:serverlessrepo:us-east-1:233054207705:applications/sepia,evanchiu,11,"s3,image,transform,nodejs,serverless-galleria",Serverless image sepia tone application,https://github.com/evanchiu/serverless-galleria,
node-exec,arn:aws:serverlessrepo:us-east-1:077246666028:applications/node-exec,AWS,11,,Demonstrates running an external process using the Node.js child_process module.,https://github.com/aws-samples/serverless-app-examples/tree/master/javascript/node-exec,
signalfx-lambda-example-python,arn:aws:serverlessrepo:us-east-1:134183635603:applications/signalfx-lambda-example-python,SignalFx,11,"realtime,wrapper,metrics,signalfx",Example of sending metrics from Python Lambda using SignalFx Wrapper to SignalFx in real-time.,,
metric-publisher-app,arn:aws:serverlessrepo:us-east-1:847660965084:applications/metric-publisher-app,Joshua Basden,11,"lambda,python,publish,cloudwatch,metrics","The Metric Publisher Application accepts metrics as input in JSON format, logs those metrics, and periodically gathers all new data from the Log Group, batches the new metrics together, and publishes them to CloudWatch. ",https://github.com/awslabs/aws-serverless-metrics-publisher,
oauth2shared,arn:aws:serverlessrepo:us-east-1:760265413520:applications/oauth2shared,Palo Alto Networks Developers Relations,11,"oauth2,panw",An experimental mock implementation of a OAUTH2 Shared Component implemented as a Serverless Application to proxy activation/authentication requests for non SaaS multi-tenant 3rd party partner applications.,https://www.paloaltonetworks.com/products/application-framework.html,
Transit,arn:aws:serverlessrepo:us-east-1:760301537001:applications/Transit,HERE Technologies,11,"here,routing,transit,map","A Lambda function to get access to features that go beyond simple estimated transit routing like search, next departures, transit isoline and pedestrian access points.",https://aws.amazon.com/marketplace/pp/B07JPLG9SR/?ref=_ptnr_aws_sar,
lambda-test-harness,arn:aws:serverlessrepo:us-east-1:077246666028:applications/lambda-test-harness,AWS,11,,Provides a simple framework for conducting various tests of your Lambda functions.,https://github.com/aws-samples/serverless-app-examples/tree/master/javascript/lambda-test-harness,
lambda-to-chime,arn:aws:serverlessrepo:us-east-1:289559741701:applications/lambda-to-chime,Keeton Hodgson,11,"lambda,serverless,Chime",This serverless application posts messages to Amazon Chime,https://github.com/keetonian/lambda-to-chime,
codepipeline-s3-deploy,arn:aws:serverlessrepo:us-east-1:775015977546:applications/codepipeline-s3-deploy,Sami Tanbouz,11,"codepipeline,s3,deploy",Unwraps compressed input artifact(s) and deploys the files to a S3 bucket with mime types. It attempts to only deploy modified files by checking S3 object Etag against md5 hash of the data. You can optionally invalidate CloudFront after deployment.,https://github.com/Tanbouz/codepipeline-s3-deploy,
LambdaEdgeRemoveTrailingSlash,arn:aws:serverlessrepo:us-east-1:951661612909:applications/LambdaEdgeRemoveTrailingSlash,Si Novi,10,"Lambda@Edge,Lambda,CloudFront,Static,S3","A Lambda@Edge function to remove trailing slashes from requests received by your CloudFront distribution. 

Designed to assist hosting static websites via S3, ensuring requests to /some/object-identifier/ are resolved to /some/object-identifier correctly",https://github.com/sinovi/lambda-edge-remove-trailing-slash,CAPABILITY_IAM
json-logs-to-kinesis-firehose,arn:aws:serverlessrepo:us-east-1:277187709615:applications/json-logs-to-kinesis-firehose,James Hood,10,"logs,json,kinesis-firehose",This serverless application forwards JSON-formatted log events for a given CloudWatch Log Group to a Kinesis Data Firehose Delivery Stream,https://github.com/jlhood/json-lambda-logs-to-kinesis-firehose,
twitter-to-slack-message,arn:aws:serverlessrepo:us-east-1:641494176294:applications/twitter-to-slack-message,ServerlessOps,10,"twitter,python,slack",Convert a Twitter tweet into a Slack API chat.postMessage message. This nanoservice is intended to be used with other SAR nanonservices in order to construct a functional application. See the README for one example.,https://github.com/ServerlessOpsIO/twitter-to-slack-message,
s3-lambda-image-text-detection-dynamodb,arn:aws:serverlessrepo:us-east-1:375983427419:applications/s3-lambda-image-text-detection-dynamodb,Aleksandar Simovic,10,"s3,lambda,detect-text,image-text-detection,rekognition,dynamodb","Detect text from images uploaded to an S3 bucket, using AWS Rekognition, and store them into a DynamoDB table.",https://github.com/simalexan/s3-lambda-image-text-detection-dynamodb,
kinesis-firehose-syslog-to-json-python,arn:aws:serverlessrepo:us-east-1:077246666028:applications/kinesis-firehose-syslog-to-json-python,AWS,10,,An Amazon Kinesis Firehose stream processor that converts input records from RFC3164 Syslog format to JSON.,https://github.com/aws-samples/serverless-app-examples/tree/master/python/kinesis-firehose-syslog-to-json-python,
alb-logs-firehose-publisher,arn:aws:serverlessrepo:us-east-1:328305143014:applications/alb-logs-firehose-publisher,Sergey Novikov,10,"firehose,alb,logs",Serverless function to stream access logs of Application ELB from S3 to Amazon Kinesis Firehose.,https://github.com/s12v/aws-alb-firehose,
AthenaAwsCmdbConnector,arn:aws:serverlessrepo:us-east-1:292517598671:applications/AthenaAwsCmdbConnector,Amazon Athena Federation,10,athena-federation,"This connector enables Amazon Athena to communicate with various AWS Services, making your resource inventories accessible via SQL.",https://github.com/awslabs/aws-athena-query-federation,CAPABILITY_IAM
autoStopRds,arn:aws:serverlessrepo:us-east-1:754380202678:applications/autoStopRds,Octo Technology Australia,10,"rds,saving,auto,cost,stop,monitor,OCTO,octo,manage",Automatically stops all RDS instances in ALL regions except excluded ones,https://www.octo.com/en,
feed-logger,arn:aws:serverlessrepo:us-east-1:590550876615:applications/feed-logger,Ranek Kiil,10,,Automatically log the body of a web result at a set frequency.,,
lex-scraper-victim-support-bot,arn:aws:serverlessrepo:us-east-1:952480533707:applications/lex-scraper-victim-support-bot,Sakaar,10,"python,api-gateway,lex","lex-scraper-victim-support-bot using Amazon lex's NLP to Be able to understand a victims query to locate the nearest Victim Service Provider on the bases of just a couple of questions which ask the user of his/her age, location, service, gender.",https://github.com/sakaar27/Serverless,
sns-lambda-put-cloudwatch,arn:aws:serverlessrepo:us-east-1:375983427419:applications/sns-lambda-put-cloudwatch,Aleksandar Simovic,10,"lambda,metric,sns,cloudwatch,nodejs,put","This is a SNS Lambda subscriber that puts notification data into a CloudWatch metric.
Written in Node.js. It's a Nuts & Bolts application component for AWS Serverless Application Repository.",https://github.com/simalexan/sns-lambda-put-cloudwatch,
kinesis-firehose-process-record-python,arn:aws:serverlessrepo:us-east-1:077246666028:applications/kinesis-firehose-process-record-python,AWS,10,,An Amazon Kinesis Firehose stream processor that accesses the records in the input and returns them with a processing status.  Use this processor for any custom transformation logic.,https://github.com/aws-samples/serverless-app-examples/tree/master/python/kinesis-firehose-process-record-python,
EpsagonLogsSender,arn:aws:serverlessrepo:us-east-1:066549572091:applications/EpsagonLogsSender,Epsagon,10,,Epsagon Logs Sender,https://www.epsagon.com,
EnergyProductFinder,arn:aws:serverlessrepo:us-east-1:647087826666:applications/EnergyProductFinder,Saleem Javed,10,"Energy,Alexa,Start,Python","Alexa skill ""Energy Product Finder"" finds the energy efficient product e.g. Bulb, Fan, AC, or Refrigerator based on the parameters provided by the user. ",https://github.com/Kitemaker/Energy-Product-Finder,
Spacy,arn:aws:serverlessrepo:us-east-1:339543757547:applications/Spacy,ryfeus,10,"spacy,NLP,natural,processing,language",Opensource library for Natural Language Processing in python. Example code loads language model from S3 and uses it to analyze sentence.,https://github.com/ryfeus/lambda-packs,
AthenaDocumentDBConnector,arn:aws:serverlessrepo:us-east-1:292517598671:applications/AthenaDocumentDBConnector,Amazon Athena Federation,10,athena-federation,"This connector enables Amazon Athena to communicate with your DocumentDB instance(s), making your DocumentDB data accessible via SQL.",https://github.com/awslabs/aws-athena-query-federation,CAPABILITY_IAM
cleanOrphanVolumes,arn:aws:serverlessrepo:us-east-1:754380202678:applications/cleanOrphanVolumes,Octo Technology Australia,9,"saving,auto,cost,ec2,volumes,OCTO,clean,octo,remove","Removes all EC2 volumes in ALL regions, which are not attached to any EC2 instance",https://www.octo.com/en,
s3-pgp-encryptor,arn:aws:serverlessrepo:us-east-1:485061371590:applications/s3-pgp-encryptor,Dan Lamb,9,"s3,encryption,PGP,gpg",PGP encrypts any file uploaded to S3 using your PGP public key. ,https://github.com/bmalnad/s3-pgp-encryptor,
rekognition-sqs,arn:aws:serverlessrepo:us-east-2:497649417889:applications/rekognition-sqs,Kashif Imran Ganesh Shankaran,9,"Rekognition,SQS,DynamoDB,source,event,Image,analysis,Lambda","Using SQS as an event source, trigger a Lambda function to perform image analysis using Amazon Rekognition and write the output to a DynamoDB table.",https://github.com/darwaishx/rekognition-sqs,
aws-sqs-dlq-redriver,arn:aws:serverlessrepo:us-east-1:303769779339:applications/aws-sqs-dlq-redriver,Lu Hong,9,,This serverless application redrives the messages from an SQS DLQ back to its source SQS queue.,https://github.com/honglu/aws-sqs-dlq-redriver,CAPABILITY_IAM
TollCost,arn:aws:serverlessrepo:us-east-1:760301537001:applications/TollCost,HERE Technologies,9,"toll,tollcost,map,here","A Lambda function that calculates the toll costs for any HERE route while taking into account various vehicle profiles, or get the cost-optimized route based on toll and vehicle costs.",https://aws.amazon.com/marketplace/pp/B07JPLG9SR/?ref=_ptnr_aws_sar,
acm-dns-record-manager,arn:aws:serverlessrepo:us-east-1:022876999554:applications/acm-dns-record-manager,Jens Eickmeyer,9,"certificate,acm,cloudformation",Automatically adds the appropriate CNAME records to the Route 53 Hosted Zone for a certificate issued by Amazon Certificate Manager (ACM).,https://github.com/CarpinusLabs/acm-dns-record-manager,CAPABILITY_IAM
workmail-wordpress-python,arn:aws:serverlessrepo:us-east-1:489970191081:applications/workmail-wordpress-python,Amazon WorkMail,9,"lambda,wordpress,workmail,email",This application automatically publishes drafts of blog posts to your WordPress blog based on email sent or received.,https://github.com/aws-samples/amazon-workmail-lambda-templates/tree/master/workmail-wordpress-python,"CAPABILITY_IAM,CAPABILITY_RESOURCE_POLICY"
amazon-cognito-passwordless-facial-rekognition-auth,arn:aws:serverlessrepo:us-east-1:825350388019:applications/amazon-cognito-passwordless-facial-rekognition-auth,Enrico Bergamo,9,"cognito,passwordless,auth,recognition,rekognition,sample,authentication,facial","An Amazon Cognito user pool, pre-configured with AWS Lambda triggers to implement passwordless facial recognition auth using Amazon Rekognition",https://github.com/aws-samples/amazon-cognito-facial-recognition-auth/tree/master/,CAPABILITY_IAM
umbrella-reminder-sms,arn:aws:serverlessrepo:us-east-1:590550876615:applications/umbrella-reminder-sms,Ranek Kiil,9,,Send a reminder to bring an umbrella on rainy days.,,
blur,arn:aws:serverlessrepo:us-east-1:233054207705:applications/blur,evanchiu,9,"serverless-galleria,transform,s3,image,nodejs",Serverless image blur,https://github.com/evanchiu/serverless-galleria,
my-app,arn:aws:serverlessrepo:us-east-1:400507177593:applications/my-app,user1,9,tests,hello world,https://github.com/user1/my-app-project,
