AutoUpdateCloudfrontSecurityGroups,arn:aws:serverlessrepo:us-east-1:194984328286:applications/AutoUpdateCloudfrontSecurityGroups,Five Talent,50,"CloudFront,SGs","Triggered by an AWS SNS notification that their IP blocks have been updated, this function will automatically update your Security Groups with specific tags.",https://github.com/FiveTalent/AutoUpdateCloudFrontSecurityGroups,
galleria,arn:aws:serverlessrepo:us-east-1:233054207705:applications/galleria,evanchiu,49,"photo,image,nodejs,web-app",Serverless photo gallery,https://github.com/evanchiu/serverless-galleria,
lambda-podcast,arn:aws:serverlessrepo:us-east-1:517266833056:applications/lambda-podcast,Marek Kuczynski,49,"mp3,rss,xml,podcast",Create a serverless podcast service using Amazon S3 for storage of music files and Lambda for generation of the podcast feed. The Lambda function can run periodically to add/remove podcast files from the S3 bucket containing your music. ,https://github.com/marekq/lambda-podcast/,
fork-example-ecommerce-checkout-pipeline,arn:aws:serverlessrepo:us-east-1:077246666028:applications/fork-example-ecommerce-checkout-pipeline,AWS,49,"aws-event-fork-pipelines,sns,e-commerce,example",This checkout pipeline is meant to be nested in the example e-commerce application that demonstrates the AWS Event Fork Pipelines apps.,https://github.com/aws-samples/aws-serverless-event-fork-pipelines,CAPABILITY_RESOURCE_POLICY
slack-echo-command,arn:aws:serverlessrepo:us-east-1:077246666028:applications/slack-echo-command,AWS,49,,A function that handles a Slack slash command and echoes the details back to the user.,https://github.com/aws-samples/serverless-app-examples/tree/master/javascript/slack-echo-command-python,
sns-lambda-subscriber-dynamodb,arn:aws:serverlessrepo:us-east-1:375983427419:applications/sns-lambda-subscriber-dynamodb,Aleksandar Simovic,48,"notification,lambda,subscribe,save,sns,nodejs,store,dynamodb,put",This is a SNS Lambda subscriber that stores notification data into a DynamoDB table. Written in Node.js. It's a Nuts & Bolts serverless application component,https://github.com/simalexan/sns-lambda-subscriber-dynamodb,
sumologic-slack,arn:aws:serverlessrepo:us-east-1:956882708938:applications/sumologic-slack,Sumo Logic,48,"lambda,sumologic,Slack,serverless",This solution consists of a lambda functions which is used to fetch logs from Slack and ingest to Sumo Logic.,https://github.com/SumoLogic/sumologic-slack,CAPABILITY_IAM
simple-contact-us-handler,arn:aws:serverlessrepo:us-east-1:318300609668:applications/simple-contact-us-handler,SLAppForge,48,"website,contact,api-gateway,nodejs,dynamodb,contact-us","This sample demonstrates the use of AWS Lambda, DynamoDB and API Gateway to implement a simple contact us form for a static web site.",https://slappforge.com/,
fork-example-ecommerce-checkout-api,arn:aws:serverlessrepo:us-east-1:077246666028:applications/fork-example-ecommerce-checkout-api,AWS,48,"aws-event-fork-pipelines,sns,e-commerce,example",This serverless application is an example of using the AWS Event Fork Pipelines apps in an e-commerce use case.,https://github.com/aws-samples/aws-serverless-event-fork-pipelines,"CAPABILITY_AUTO_EXPAND,CAPABILITY_NAMED_IAM,CAPABILITY_RESOURCE_POLICY"
timber-logging,arn:aws:serverlessrepo:us-east-1:754402436383:applications/timber-logging,Timber Technologies,46,logging,Serverless application that forwards AWS CloudWatch logs to the Timber.io logging service.,https://github.com/timberio/timber-cloudwatch-logs-lambda-function,
Datadog-VPC-Flow-Logs,arn:aws:serverlessrepo:us-east-1:464622532012:applications/Datadog-VPC-Flow-Logs,Datadog,46,"datadog,metrics,flowlog,vpc,logs","The Datadog VPC flow log application captures flow log data from CloudWatch logs, parses out metrics and tags, ands sends it to Datadog for alerting, dashboarding, and analyzing. ",,
Twitter-Poller-to-Kinesis-Firehose,arn:aws:serverlessrepo:us-east-1:381943442500:applications/Twitter-Poller-to-Kinesis-Firehose,Adam Westrich,44,"Alexa,Kinesis,Firehose,DynamoDB,Twitter,Voice,Powered,Lambda,Analytics","Query Twitter, which sends tweets to Kinesis Firehose to stream into a data source (eg S3) for query aggregations. Foundational setup of popular self-paced Voice Powered Analytics workshop https://github.com/awslabs/voice-powered-analytics",https://github.com/awslabs/voice-powered-analytics,"CAPABILITY_IAM,CAPABILITY_RESOURCE_POLICY"
docx-to-pdf,arn:aws:serverlessrepo:us-east-1:992364115735:applications/docx-to-pdf,Native Documents,44,"docx_to_PDF,Word_to_PDF,ms-word_to_PDF,s3_to_PDF,Office_to_PDF,doc_to_PDF","Microsoft Word doc/docx to PDF conversion, using S3 buckets",https://nativedocuments.com,
lex-make-appointment,arn:aws:serverlessrepo:us-east-1:077246666028:applications/lex-make-appointment,AWS,44,,"Schedule a dentist appointment, using Amazon Lex to perform natural language understanding",https://github.com/aws-samples/serverless-app-examples/tree/master/javascript/lex-make-appointment,
Alexa-Nodejs-Dynamic-Content,arn:aws:serverlessrepo:us-east-1:962622311275:applications/Alexa-Nodejs-Dynamic-Content,Mohamed Hassan AbdulRahman,43,"Skill,Dynamic,Choices,Alexa,Buzzle,Content,Games,DynamoDB,Questions,Stories","This Alexa skill template help developer to build dynamic content that can be totally controlled by data saved in DynamoDB. After publishing, developer can modify the skill content and behavior through the database.",https://github.com/mrahman4/AlexaSamTemplate,
s3-replicator,arn:aws:serverlessrepo:us-east-1:233054207705:applications/s3-replicator,evanchiu,43,"s3,copy",Replicates S3 objects to configured buckets,https://github.com/evanchiu/s3-replicator,
slack-echo-command-python,arn:aws:serverlessrepo:us-east-1:077246666028:applications/slack-echo-command-python,AWS,43,,A function that handles a Slack slash command and echoes the details back to the user.,https://github.com/aws-samples/serverless-app-examples/tree/master/python/slack-echo-command-python,
whats-your-name,arn:aws:serverlessrepo:us-east-1:180876865127:applications/whats-your-name,Piotr Mlocek,42,"rekognition,ai,lambda,api-gateway,photo,picture,s3",App that can recognize who is on the photo! Create a collection by uploading photos of people you want to recognize and then use the web-app to check who is on the picture (you can use your mobile phone's camera!),https://github.com/pimlock/whats-your-name,
S3-Image-Monitoring-Detection-Using-Rekognition-Publish-Data-on-SNS,arn:aws:serverlessrepo:us-east-1:647087826666:applications/S3-Image-Monitoring-Detection-Using-Rekognition-Publish-Data-on-SNS,Saleem Javed,41,"S3,Bucket,Python3,SNS,Labels,Image,Topic,rekognition,Lambda","Monitor S3 Bucket, on image upload, Lambda Function detect labels, moderation labels  and text in the updated/created image using AWS rekognition API and publish labels and texts on the SNS Topic. Based on Python3.6",https://github.com/Kitemaker/S3-Image-Monitoring-Detection-Using-Rekognition-Publish-Data-on-SNS,
kinesis-firehose-apachelog-to-json,arn:aws:serverlessrepo:us-east-1:077246666028:applications/kinesis-firehose-apachelog-to-json,AWS,41,"Kinesis,Firehose,convertor,AWS,sample",An Amazon Kinesis Firehose stream processor that converts input records from Apache Common Log format to JSON.,https://github.com/aws-samples/serverless-app-examples/tree/master/javascript/kinesis-firehose-syslog-to-json,
api-gateway-authorizer-python,arn:aws:serverlessrepo:us-east-1:077246666028:applications/api-gateway-authorizer-python,AWS,40,,"A sample application for API Gateway custom authorizers, implemented in Python 2.7.",https://github.com/aws-samples/serverless-app-examples/tree/master/python/api-gateway-authorizer-python,
compress,arn:aws:serverlessrepo:us-east-1:233054207705:applications/compress,evanchiu,40,"s3,image,transform,nodejs,serverless-galleria",Serverless image compression,https://github.com/evanchiu/serverless-galleria,
ALB-Lambda-Target-WhatisMyIP,arn:aws:serverlessrepo:us-east-1:072567720793:applications/ALB-Lambda-Target-WhatisMyIP,AWS Elastic Load Balancing,40,"Target,lambda,alb,ALB,Lambda,target",WhatisMyIP Lambda function template for Application Load Balancer Lambda as target,https://github.com/aws/elastic-load-balancing-tools/tree/master/application-load-balancer-serverless-app/whatismyip,
github-codebuild-logs,arn:aws:serverlessrepo:us-east-1:277187709615:applications/github-codebuild-logs,James Hood,39,"github,pr,ci,codebuild,logs","This serverless app creates publicly accessible links to PR build logs for a given AWS CodeBuild project and posts them as a comment on the corresponding GitHub PR.
",https://github.com/jlhood/github-codebuild-logs,CAPABILITY_IAM
Weather,arn:aws:serverlessrepo:us-east-1:760301537001:applications/Weather,HERE Technologies,39,"here,weather,map","A lambda function to give insights into real-time weather forecasts, alerts, and astronomical info for any location.",https://aws.amazon.com/marketplace/pp/B07JPLG9SR/?ref=_ptnr_aws_sar,
ThundraHelloWorld,arn:aws:serverlessrepo:us-east-1:269863060030:applications/ThundraHelloWorld,Thundra,38,"tracing,insturmentation,lambda,java,profiling,debugging,monitoring,example",An example project to monitor Java lambda functions via Thundra. You just need to create an API key from Thundra and see the rest!,https://github.com/thundra-io/examples-java/tree/master/hello-world,
cw-logs-to-lambda,arn:aws:serverlessrepo:us-east-1:289559741701:applications/cw-logs-to-lambda,Keeton Hodgson,37,"lambda,CloudWatch,serverless,logs",Filters CloudWatch logs and publishes them to another lamdba function,https://github.com/keetonian/cw-logs-to-lambda,
slack-slash-hodor,arn:aws:serverlessrepo:us-east-1:485061371590:applications/slack-slash-hodor,Dan Lamb,37,"slack,slash,hodor","Demonstrates basic handling of a Slack slash command by responding to questions from users.  Sets up a new '/Hodor' Slack Slash Command:

/Hodor what is the meaning of life?
",https://github.com/bmalnad/slack-slash-hodor,
cloudfront-s3-origin-website-redirects,arn:aws:serverlessrepo:us-east-1:646719517841:applications/cloudfront-s3-origin-website-redirects,Sander Knape,37,"s3,redirect,cloudfront",A function that implements standard webserver redirects for when using the S3 REST API endpoint as an origin for a CloudFront distribution.,https://github.com/SanderKnape/cloudfront-s3-origin-website-redirects,
api-lambda-delete-dynamodb,arn:aws:serverlessrepo:us-east-1:375983427419:applications/api-lambda-delete-dynamodb,Aleksandar Simovic,37,"lambda,item,cors,api,nodejs,delete,dynamodb",This is a Lambda function that deletes an Item from a DynamoDB Table based on the API Gateway request. Supports CORS. Written in Node.js. It's a Nuts & Bolts application component for AWS Serverless Application Repository.,https://github.com/simalexan/api-lambda-delete-dynamodb,
sns-subscriber-lambda-s3,arn:aws:serverlessrepo:us-east-1:375983427419:applications/sns-subscriber-lambda-s3,Aleksandar Simovic,37,"s3,lambda,subscribe,sns,nodejs","This is a SNS Lambda subscriber that stores the SNS message data into an S3 Bucket.

Written in Node.js.

It's a Nuts & Bolts application component for AWS Serverless Application Repository.",https://github.com/simalexan/sns-subscriber-lambda-s3,
kinesis-process-record,arn:aws:serverlessrepo:us-east-1:077246666028:applications/kinesis-process-record,AWS,37,,An Amazon Kinesis stream processor that logs the data being published.,https://github.com/aws-samples/serverless-app-examples/tree/master/javascript/kinesis-process-record,
ses-notification-to-s3,arn:aws:serverlessrepo:us-east-1:365464100180:applications/ses-notification-to-s3,Yuki Matsushita,36,"ses,s3","An Amazon SES notification handler for processing bounces, complaints and deliveries to upload to an Amazon S3 bucket.",,
alexa-salesforce-notes-sample,arn:aws:serverlessrepo:us-east-1:473507220772:applications/alexa-salesforce-notes-sample,Alexa for Business,34,"alexa,alexa-for-business,salesforce","This skill demonstrates how to build a private Alexa skill to access Salesforce data. This skill identifies a given opportunity, tracks a series of statements that a user gives, and posts those either as a note or as a Chatter post. ",https://aws.amazon.com/alexaforbusiness/,
codepipeline-artifact-merge,arn:aws:serverlessrepo:us-east-1:775015977546:applications/codepipeline-artifact-merge,Sami Tanbouz,34,"codepipeline,codedeploy",Merge artifacts in AWS CodePipeline into a single artifact using AWS Lambda.,,
DailyDoggo,arn:aws:serverlessrepo:us-east-1:653771569958:applications/DailyDoggo,Kevin McCandless,34,"lambda,sns,dog","Send a link to a random dog picture to a phone number daily, via AWS Lambda and SNS.",,
cloudwatch-logs-process-data,arn:aws:serverlessrepo:us-east-1:077246666028:applications/cloudwatch-logs-process-data,AWS,34,"data,CloudWatch,logs,AWS,sample",A real-time consumer of log events ingested by Amazon CloudWatch Logs,https://github.com/aws-samples/serverless-app-examples/tree/master/javascript/cloudwatch-logs-process-data,
aws-serverless-codepipeline-serverlessrepo-publish,arn:aws:serverlessrepo:us-east-1:077246666028:applications/aws-serverless-codepipeline-serverlessrepo-publish,AWS Serverless Application Repository,34,"codepipeline,serverless,serverlessrepo",This serverless application publishes applications to AWS Serverless Application Repository. This app creates a Lambda function that a user could then use as an Invoke action target in their CodePipeline.,https://github.com/awslabs/aws-serverless-codepipeline-serverlessrepo-publish,CAPABILITY_IAM
iot-twillio-bridge,arn:aws:serverlessrepo:us-east-1:123940773876:applications/iot-twillio-bridge,TensorIoT,34,"aws-iot,twilio,iot",This service provides a bridge between AWS IoT and Twilio for your devices to send messages to Twillio.,,
aws-tag-explorer,arn:aws:serverlessrepo:us-east-1:423596961626:applications/aws-tag-explorer,Marcilio Mendonca,34,"Tagging,Tag,Tags,S3Select,SQL",Extract all tags from your AWS account into a S3 file. Query tags file with SQL.,https://github.com/marcilio/aws-tag-explorer,
cw-logs-to-slack,arn:aws:serverlessrepo:us-east-1:289559741701:applications/cw-logs-to-slack,Keeton Hodgson,34,"CloudWatch,slack,serverless,logs",Filters CloudWatch logs and publishes them to Slack,https://github.com/keetonian/cw-logs-to-slack,CAPABILITY_AUTO_EXPAND
sumologic-loggroup-connector,arn:aws:serverlessrepo:us-east-1:956882708938:applications/sumologic-loggroup-connector,Sumo Logic,34,"lambda,sumologic,serverless,cloudwatch,loggroup,sam",This is used to automatically subscribe newly created and existing Cloudwatch LogGroups to a Lambda function.,https://github.com/SumoLogic/sumologic-aws-lambda/tree/master/loggroup-lambda-connector,"CAPABILITY_IAM,CAPABILITY_RESOURCE_POLICY"
s3-image-indexer,arn:aws:serverlessrepo:us-east-1:831212071815:applications/s3-image-indexer,Kwun-Hok Chan,34,"s3,image,python,elasticsearch,aws,rekognition",An AWS Lambda function that indexes images uploaded to a S3 bucket based on labels detected by Amazon Rekognition.,,
cloudwatch-alarm-to-slack-python3,arn:aws:serverlessrepo:us-east-1:077246666028:applications/cloudwatch-alarm-to-slack-python3,AWS,33,"SNS,trigger,AWS,sample,CloudWatch",Serverless application that sends CloudWatch alarm notifications to Slack on an Amazon SNS trigger,https://github.com/aws-samples/serverless-app-examples/tree/master/python/cloudwatch-alarm-to-slack-python3,
lex-book-trip-python,arn:aws:serverlessrepo:us-east-1:077246666028:applications/lex-book-trip-python,AWS,32,,"Book details of a visit, using Amazon Lex to perform natural language understanding",https://github.com/aws-samples/serverless-app-examples/tree/master/python/lex-book-trip-python,
alexa-city-biking-skill,arn:aws:serverlessrepo:us-east-1:372207227647:applications/alexa-city-biking-skill,Chris Buonocore,32,"city,skill,bikeshare,alexa,biking,facts,sam,citybiking,bike","Alexa Skill deployed on SAM and based on NodeJS fact template. 
- Understands fuzzy queries with streets and locations, and gives the number of free bikes.
- Gives Bike Facts
- Works in most major US cities.",https://github.com/cbonoz/city-biking,
SmarterCamera-DeepLens-PeopleTracking,arn:aws:serverlessrepo:us-east-1:072676109536:applications/SmarterCamera-DeepLens-PeopleTracking,Paul Fryer,32,"SageMaker,KinesisVideo,DeepLens,Rekogntion,ML",Deploy this function to your DeepLens and use with Smarter Camera (https://smarter.camera) to track people in video you capture.,https://smarter.camera,
vocal-warmup-alexa-skill,arn:aws:serverlessrepo:us-east-1:675369106697:applications/vocal-warmup-alexa-skill,Janson Chiu,32,"vocal,warmup",vocal warm up skill using audio player ,https://github.com/jansonchiu,
cloudfront-redirect-on-viewer-country,arn:aws:serverlessrepo:us-east-1:077246666028:applications/cloudfront-redirect-on-viewer-country,AWS,31,,Sample application for generating a redirect response based on the viewer country. Triggered by an origin-request. Implemented in NodeJS.,https://github.com/aws-samples/serverless-app-examples/tree/master/javascript/cloudfront-redirect-on-viewer-country,
acentera-prod-core,arn:aws:serverlessrepo:us-east-1:356769441913:applications/acentera-prod-core,ACenterA,31,"serverlesscms,acentera,plugins,cms,serverless","[prod] AWS CMS Portal solution to get you started with AWS. Integrate with Lambda, Cognito, DynamoDB, AppSync and API Gateway to provide an easy to start serverless solution.
The solution is made to be cost effective, highly secure, and very scalable.",https://acentera.com/,CAPABILITY_NAMED_IAM
dynamodb-lambda-publisher-sns,arn:aws:serverlessrepo:us-east-1:375983427419:applications/dynamodb-lambda-publisher-sns,Aleksandar Simovic,31,"lambda,stream,publish,sns,dynamodb","This is a Lambda publisher that listens to newly stored items to your DynamoDB table and then publishes a message to a SNS topic.
Written in Node.js. It's a Nuts & Bolts application component for AWS Serverless Application Repository.",https://github.com/simalexan/dynamodb-lambda-publisher-sns,
AthenaCloudwatchMetricsConnector,arn:aws:serverlessrepo:us-east-1:292517598671:applications/AthenaCloudwatchMetricsConnector,Amazon Athena Federation,31,athena-federation,"This connector enables Amazon Athena to communicate with Cloudwatch Metrics, making your metrics data accessible via SQL.",https://github.com/awslabs/aws-athena-query-federation,CAPABILITY_IAM
kinesis-process-record-python,arn:aws:serverlessrepo:us-east-1:077246666028:applications/kinesis-process-record-python,AWS,30,,An Amazon Kinesis stream processor that logs the data being published.,https://github.com/aws-samples/serverless-app-examples/tree/master/python/kinesis-process-record-python,
autoStopEc2,arn:aws:serverlessrepo:us-east-1:754380202678:applications/autoStopEc2,Octo Technology Australia,30,"saving,auto,cost,stop,ec2,monitor,OCTO,octo,manage",Automatically stops all EC2 instances in ALL regions except excluded ones,https://www.octo.com/en,
deploy-to-s3,arn:aws:serverlessrepo:us-east-1:375983427419:applications/deploy-to-s3,Aleksandar Simovic,30,"s3,lambda,layer,deploy","Deploy and publish Frontend SPA apps, UI components, static websites and MicroFrontends to S3 and Serverless Application Repository using this Lambda Layer component",https://github.com/serverlesspub/cloudformation-deploy-to-s3,CAPABILITY_RESOURCE_POLICY
sumologic-mongodb-atlas,arn:aws:serverlessrepo:us-east-1:956882708938:applications/sumologic-mongodb-atlas,Sumo Logic,29,"lambda,sumologic,atlas,serverless,MongoDBAtlas",This solution consists of a lambda functions which is used to fetch logs from MongoDB Atlas and ingest to Sumo Logic.,https://github.com/SumoLogic/sumologic-mongodb-atlas,CAPABILITY_IAM
ImageProcessingPython,arn:aws:serverlessrepo:us-east-1:339543757547:applications/ImageProcessingPython,ryfeus,29,"image,pil,pillow,processing,opencv","Package of image processing tools, and not only to style image, but also a large set of Computer vision algorithms. Contains OpenCV and Pillow.",https://github.com/ryfeus/lambda-packs,
ecr-deploy,arn:aws:serverlessrepo:us-east-1:109625914275:applications/ecr-deploy,Vincent Lesierse,29,"container,cluster,ecs,ecr,docker,deploy,deployment",This Lambda function will create a CloudWatch event rule which will be triggered as soon as a Docker image is pushed to ECR and deploys it automatically to a ECS Cluster.,https://github.com/vlesierse/aws-ecs-automation,
ChimeBot-Whats-New-At-AWS,arn:aws:serverlessrepo:us-east-1:171473150649:applications/ChimeBot-Whats-New-At-AWS,Francois-Xavier Gsell,28,"aws,chime",A ChatBot for Amazon Chime that sends a message to a group for each news from AWS.,,
UvaSoftware-Scanii-Lambda,arn:aws:serverlessrepo:us-east-1:484983087487:applications/UvaSoftware-Scanii-Lambda,Uva Software LLC,28,"s3,scanii,malware,identification,uvasoftware,nodejs,analysis,content,javascript","Analyze your S3 objects using scanii.com's content analysis service. Identify and tag (or potentially delete) malware, phishing, spam as well as NSFW language and images. ",https://github.com/uvasoftware/scanii-lambda,CAPABILITY_IAM
cw-logs-to-chime,arn:aws:serverlessrepo:us-east-1:289559741701:applications/cw-logs-to-chime,Keeton Hodgson,27,"serverless,Chime,CloudWatch,logs",This serverless application posts filtered logs from CloudWatch to Amazon Chime,https://github.com/keetonian/cw-logs-to-chime,
signalfx-lambda-example-java,arn:aws:serverlessrepo:us-east-1:134183635603:applications/signalfx-lambda-example-java,SignalFx,27,"realtime,wrapper,metrics,signalfx",Example of sending metrics from Java Lambda using SignalFx Wrapper to SignalFx in real-time.,,
Kinesis-Enhanced-Fan-Out-to-DDB-S3,arn:aws:serverlessrepo:us-east-1:700336187521:applications/Kinesis-Enhanced-Fan-Out-to-DDB-S3,Eric Johnson,27,"Node,Enhanced-Fan-Out,Serverless,Kinesis-Data-Stream,Lambda",Creates an Amazon Kinesis Data Stream and uses enhanced fan-out with AWS Lambda functions to write to a an Amazon DynamoDB table and Amazon S3 Bucket,https://github.com/singledigit/kinesis-fan-out-sam,
sns2chime,arn:aws:serverlessrepo:us-east-1:903779448426:applications/sns2chime,Pahud Hsieh,27,"webhook,IM,chatops,chime",sns2chime is a serverless relay service forwarding the incoming SNS messages to your Chime chat room.,,
SecretsManagerRDSSQLServerRotationMultiUser,arn:aws:serverlessrepo:us-east-1:297356227824:applications/SecretsManagerRDSSQLServerRotationMultiUser,AWS Secrets Manager,26,,Conducts an AWS SecretsManager secret rotation for RDS SQL Server using the multiple user rotation scheme,,"CAPABILITY_IAM,CAPABILITY_RESOURCE_POLICY"
kinesis-firehose-process-record-streams-as-source,arn:aws:serverlessrepo:us-east-1:077246666028:applications/kinesis-firehose-process-record-streams-as-source,AWS,26,,An Amazon Kinesis Firehose stream processor that accesses the Kinesis Streams records in the input and returns them with a processing status.,https://github.com/aws-samples/serverless-app-examples/tree/master/javascript/kinesis-firehose-process-record-streams-as-source-python,
NYC-Parks-Events-Crawler,arn:aws:serverlessrepo:us-east-1:242860417674:applications/NYC-Parks-Events-Crawler,Chris Munns,26,"python,crawler,dynamodb",This AWS Serverless Application crawls the NYC Parks's Events website (https://www.nycgovparks.org/events/) and generates a scoped view of the data listed there and stores it in an Amazon DynamoDB Table.,https://github.com/teknogeek0/ServerlessNYCParksEventsSiteCrawler,
ghostscript-lambda-layer,arn:aws:serverlessrepo:us-east-1:154387959412:applications/ghostscript-lambda-layer,Tomislav Capan,26,"lambda,pdf,gs,layer,ghostscript","Ghostscript AWS Lambda layer adding PDF files conversion support using ImageMagick. Bundles Ghostscript 9.27.
",https://github.com/zappan/ghostscript-lambda-layer,
podless,arn:aws:serverlessrepo:us-east-1:656097458897:applications/podless,Stilvoid,26,"s3,bucket,mp3,download,rss,podcast",A serverless application that downloads podcasts to an S3 bucket.,,
python-sam-codebuild-ci,arn:aws:serverlessrepo:us-east-1:277187709615:applications/python-sam-codebuild-ci,James Hood,26,"github,python,ci,codebuild,continuous-integration,sam","This serverless app sets up an AWS CodeBuild Project as a CI solution for a GitHub-based SAM python project. Once setup, everytime you push to your GitHub repository, CodeBuild will kick off a build verifying your latest changes.
",https://github.com/jlhood/python-sam-codebuild-ci,"CAPABILITY_AUTO_EXPAND,CAPABILITY_NAMED_IAM"
ServerlessNetworkingPython3,arn:aws:serverlessrepo:us-east-1:293602984666:applications/ServerlessNetworkingPython3,timwagner,26,networking,Serverless networking client for python3.7 and forward,https://github.com/serverlessunicorn/ServerlessNetworkingClients,CAPABILITY_IAM
TweetEventSource,arn:aws:serverlessrepo:us-east-1:771389557967:applications/TweetEventSource,William Weiss,26,"lambda,twitter,search,polling,source,tweet,api,events",A serverless app that periodically polls the public Twitter API with a predefined search query and invokes a given lambda function to process new tweets.,https://github.com/wweiss/aws-serverless-tweet-event-source,
sumologic-guardduty-benchmark,arn:aws:serverlessrepo:us-east-1:956882708938:applications/sumologic-guardduty-benchmark,Sumo Logic,26,"security,sumologic,serverless,guarddutybenchmark,guardduty,benchmark",This function is invoked by AWS CloudWatch events in response to state change in your AWS resources which matches a event target definition. The event payload received is then forwarded to Sumo Logic HTTP source endpoint.,https://github.com/SumoLogic/sumologic-aws-lambda,"CAPABILITY_AUTO_EXPAND,CAPABILITY_IAM"
